"desig","details","org","loc","keyskills","date","expLow","expHigh","salLow","salHigh "
"HR Marketing","HR Marketing","S.P.Jagannath & Sons","Kanpur","Sales- FMCG- consumer durable- food- beverage- dairy- restaurant- spices...","2018-03-20",5.0,8.0,300000.0,450000.0
"HR Marketing","HR Marketing","S.P.Jagannath & Sons","Lucknow","Sales- FMCG- consumer durable- food- beverage- dairy- restaurant- spices...","2018-03-20",5.0,8.0,300000.0,450000.0
"HR Marketing","HR Marketing","S.P.Jagannath & Sons","Delhi NCR- Ghaziabad- Noida","Sales- FMCG- consumer durable- food- beverage- dairy- restaurant- spices...","2018-03-20",5.0,8.0,350000.0,750000.0
"SAP ABAP Consultant - Hcm/hr Modules","SAP ABAP Consultant - Hcm/hr Modules","KenQA Services","Gurgaon","SAP ABAP- SAP Workflow- WebDynPro ABAP- SAP ABAP Consultant...","2018-03-21",6.0,10.0,0.0,0.0
"Senior Officer HR","Senior Officer HR","Sandeep Mukherjee Consulting Services","Howrah Amtaroad","HR- PMS- Compliances","2018-03-22",3.0,5.0,0.0,0.0
"HR Executive Talent Acquisition (must have Sales Experience)","HR Executive Talent Acquisition (must have Sales Experience)","IndiaMART InterMESH Ltd","Noida(Sector-142 Noida)","selection process- hr- recruitment- talent acquisition...","2018-03-20",1.0,3.0,200000.0,250000.0
"Urgent Hiring For HR Executive in Immigration Firm - Malviya Nagar","Urgent Hiring For HR Executive in Immigration Firm - Malviya Nagar","World Overseas Services","Delhi NCR(Malviya Nagar)- Delhi","visa- ticketing- travel- cold calling- consultant- immigration- female...","2018-03-20",0.0,5.0,150000.0,350000.0
"Start your Career into HR Recruitment with Allegis Group- Chennai","Start your Career into HR Recruitment with Allegis Group- Chennai","Allegis Services India Pvt. Ltd.","Chennai","it recruitment- screening- hr- hiring- Btech- Mca- bsc- recruitmnent- ba...","2018-03-20",0.0,1.0,225000.0,300000.0
"Plant Hr/ir Manager","Plant Hr/ir Manager","Premium","Hyderabad","HR- Recruitment- Trade Union- Administration- Employee Engagement...","2018-03-20",10.0,15.0,0.0,0.0
"Apply Immediately || Urgent Opening || HR Recruiter-goregaon (e)mumbai","Apply Immediately || Urgent Opening || HR Recruiter-goregaon (e)mumbai","Dynpro India Pvt. Ltd.","Mumbai","Recruitment- staffing- resourcing- Non IT Recruitment- finance domain...","2018-03-20",2.0,4.0,175000.0,300000.0
"Job Opening for HR Executive with MNC at Shirwal Location","Job Opening for HR Executive with MNC at Shirwal Location","Le Human Resources Solutions Pvt Ltd","Pune(Shirwal)","Recruitment- Screening- Telephonic- Interview Scheduling- Interviewing...","2018-03-20",2.0,4.0,0.0,0.0
"HR Intern","HR Intern","ManpowerGroup Services India Private Limited","Hyderabad","Recruitment- Induction- HR- Selection- Payroll- Interviewing- Procedures...","2018-03-20",0.0,1.0,100000.0,200000.0
"Hiring HR Generalist  ( 6 Months to 3 year exp )  in Bangalore","Hiring HR Generalist  ( 6 Months to 3 year exp )  in Bangalore","ManpowerGroup Services India Private Limited","Bengaluru","HR Generalist Activities- HR Generalist- hr operations...","2018-03-20",1.0,3.0,100000.0,300000.0
"HR Recruiter","HR Recruiter","Black Turtle India Pvt Ltd","Bengaluru","shortlisting- recruitment- screening- hiring- sourcing- hr- compensation...","2018-03-20",0.0,3.0,0.0,0.0
"HR Recruiter","HR Recruiter","Ad Astra Consultants Private Limited.","Bengaluru","Non IT Recruitment- Screening- Sourcing- HR","2018-03-20",0.0,4.0,100000.0,300000.0
"Hiring HR Recruiters for Non-it Recruitment- West Delhi","Hiring HR Recruiters for Non-it Recruitment- West Delhi","The Vertical Recruiters","Delhi","Non IT Recruitment- Hr Mba- Hr Fresher- Bulk Hiring- Mba Hr Fresher- HR...","2018-03-20",0.0,3.0,100000.0,250000.0
"HR Exe--- Bangalore","HR Exe--- Bangalore","Busisol Sourcing India Pvt Ltd","Bengaluru","Non It- IT Recruiter","2018-03-20",1.0,3.0,150000.0,250000.0
"Looking for HR Executive with a Reputed University-bangalore","Looking for HR Executive with a Reputed University-bangalore","ASCENT STAFFING SOLUTIONS PVT LTD","Bengaluru(Richmond Town)","Recruitment- Screening- HR Operations- Interviewing- Sourcing- Onboarding...","2018-03-20",3.0,4.0,0.0,0.0
"Recruiter/internal HR- Noida","Recruiter/internal HR- Noida","Mount Talent Consulting Private Limited","Delhi NCR","Recruitment- Hiring- Interviewing- Head Hunting","2018-03-20",0.0,3.0,150000.0,400000.0
"HR Recruiter - Consultancy || North Campus Delhi","HR Recruiter - Consultancy || North Campus Delhi","Pathfinders Global Private Limited","Delhi NCR(Shakti Nagar)","Recruitment- Shortlisting- Screening- Sourcing- Interviewing- HR- Salary...","2018-03-20",0.0,5.0,200000.0,300000.0
"Job Opportunity for HR Recruiter Position in Bangalore","Job Opportunity for HR Recruiter Position in Bangalore","Tritium Consulting Private Limited","Bengaluru","recruitment- screening- salary negotiation- sourcing- interviewing...","2018-03-20",0.0,1.0,0.0,0.0
"Female HR Professionals","Female HR Professionals","ABACUS Consultants","Jaipur","Recruitment Management- HR- Screening- Head Hunting- Hiring- Selection...","2018-03-20",0.0,5.0,175000.0,400000.0
"Assistant Manager/ Manager - HR","Assistant Manager/ Manager - HR","Wipro GSH (A Division of Wipro Limited)","Bengaluru","Performance management- Employee engagement- Talent management- SAP...","2018-03-21",4.0,6.0,0.0,0.0
"HR Business Partner - 6 Days Working","HR Business Partner - 6 Days Working","CARS24 SERVICES PRIVATE LIMITED","Bengaluru","HR Policies- Employee Relations- Training Needs- Joining Formalities...","2018-03-21",2.0,4.0,0.0,0.0
"Manager / Sr. Manager - Human Resource Management","Manager / Sr. Manager - Human Resource Management","RightMatch HR Services Pvt. Ltd.","Mumbai","HR- Performance Management- Human Resource Management- Interpersonal Skills...","2018-03-16",4.0,5.0,0.0,0.0
"HR Recruiter/ Sr. Recruiter","HR Recruiter/ Sr. Recruiter","PES HR Services a div of AMAL INFOSYSTEMS Pvt Ltd","Navi Mumbai","Recruitment- Interviewing- HR- Sourcing- comunication","2018-03-20",0.0,3.0,0.0,0.0
"job Opportunity for HR Recruiter / IT and Non-it Recruiter","job Opportunity for HR Recruiter / IT and Non-it Recruiter","ELEMENTS HR SERVICES PVT LTD","Delhi NCR","hr- IT Recruitment- Non IT Recruitment- Recruitment- human resource","2018-03-20",1.0,3.0,150000.0,300000.0
"Manager - Human Resource - FMCG","Manager - Human Resource - FMCG","Premium","Chennai","HR Operations- Recruitment- Employee Engagement- Employee Relations...","2018-03-21",10.0,14.0,0.0,0.0
"HR Business Partner - 5-6 Years - Chennai","HR Business Partner - 5-6 Years - Chennai","BVR People Consulting","Chennai","HR Policies- Employee Relations- HR Strategy- Talent Acquisition...","2018-03-21",5.0,7.0,0.0,0.0
"HR Executive - Navi Mumbai","HR Executive - Navi Mumbai","Intellectual Capital Hr Consulting Pvt Ltd","Navi Mumbai","Hr Mba- Recruitment- Employee Engagement- HRIS- Life Cycle...","2018-03-15",1.0,5.0,200000.0,400000.0
"HR Recruiter (sohna Road Gurgaon)","HR Recruiter (sohna Road Gurgaon)","INNOVATION TRIGGERS MGMT PRIVATE LIMITED","Gurgaon","Recruitment- Selection- Head Hunting- HR- Interviewing- Mapping...","2018-03-22",0.0,2.0,0.0,0.0
"HR Executive / Trainee HR","HR Executive / Trainee HR","New Korba Hospital","Korba","HR- Recruitment- Induction- PF- Payroll- ESI- Attendance...","2018-03-20",0.0,2.0,0.0,0.0
"HR Manager","HR Manager","New Korba Hospital","Korba","HR- Recruitment- Induction- PF- Payroll- Attendance...","2018-03-20",1.0,4.0,0.0,0.0
"HR Executive","HR Executive","Excelsior Research Private Limited","Pune(Vishrantwadi)","HR- Recruitment- Joining Formalities- Attendance Management...","2018-03-20",0.0,5.0,200000.0,300000.0
"HR Recruiter","HR Recruiter","Trac Fujico Air Systems Llp","Chennai","hiring assistant- recruitment assistant- staffing assistant...","2018-03-20",2.0,7.0,100000.0,175000.0
"HR Executive (female Candidates Only)","HR Executive (female Candidates Only)","Adcanopus Digital Media Private Limited","Bengaluru(3rd Phase JP Nagar)","Recruitment- Sourcing- Linkedin- HR- Social Media- Employee Engagement- End...","2018-03-20",2.0,3.0,0.0,0.0
"HR Executive","HR Executive","Katra Phytochem","Bengaluru(Indira Nagar)","hr recruitment- hr executive- hr generalist","2018-03-20",1.0,3.0,0.0,0.0
"Opening for Profile of HR Executive for our Reputed Office in NFC","Opening for Profile of HR Executive for our Reputed Office in NFC","N.M. Tours and Travels","Delhi","Communication Skills- HR- HR Executive- Telecalling- Female- Fresher...","2018-03-20",0.0,2.0,0.0,0.0
"HR Executive_2-4 Years_bangalore","HR Executive_2-4 Years_bangalore","Digicom Systems (Blr) PVt. LTd.","Bengaluru(7th Phase JP Nagar)","recruitment- hr- hr executive- screening- sourcing- shortlisting- interview...","2018-03-20",2.0,4.0,250000.0,350000.0
"HR - Retail Industry","HR - Retail Industry","M/S Amps Facilities Management Services Pvt Ltd","Bengaluru","Recruitment- HR- Lead Generation","2018-03-20",2.0,7.0,125000.0,300000.0
"HR Recruiter","HR Recruiter","TRUST INDIA SOLUTIONS","Kolkata(Dunlop)","Spoken English- Fresher","2018-03-20",0.0,1.0,0.0,0.0
"Job Opportunity for Junior HR Executive","Job Opportunity for Junior HR Executive","Addweb solution pvt ltd","Ahmedabad","Recruitment- Head Hunting- Sourcing Profiles- HR","2018-03-20",0.0,1.0,0.0,0.0
"HR Manager Hiring @ Rama Krishna Jewellers - Lajpat Nagar","HR Manager Hiring @ Rama Krishna Jewellers - Lajpat Nagar","Ramakrishna jewellers pvt ltd","Delhi(Lajpat Nagar II)","recruitment- hiring- hr- human resource management- exit process...","2018-03-20",4.0,9.0,0.0,0.0
"HR Executive","HR Executive","Innverse Technologies Pvt. Ltd.","Noida(Sector-63 Noida)","recruitment- hr- exit interviews- joining formalities- induction...","2018-03-20",0.0,2.0,0.0,0.0
"Currently Hiring For  Sr. HR Recruiter / Team Lead","Currently Hiring For  Sr. HR Recruiter / Team Lead","Career Tree HR Solutions Pvt. Ltd.","Bengaluru","Recruitment- Screening- Head Hunting- Sourcing- Hiring- HR- Team Leading...","2018-03-20",1.0,3.0,0.0,0.0
"HR Executive","HR Executive","Mailkoot communications Pvt Ltd","Bengaluru(3rd Phase JP Nagar)","sourcing- linkedin- hr executive- hr assistant- Recruitment Specialist...","2018-03-20",1.0,2.0,175000.0,250000.0
"HR Recruiter (female Candidate Only)","HR Recruiter (female Candidate Only)","Simson Softwares Private Limited","Mohali","Recruitment- Sourcing- HR- English Language- Verbal Communication- Database...","2018-03-20",1.0,2.0,175000.0,250000.0
"HR Executive - Urgent Opening","HR Executive - Urgent Opening","Glomark Software Services Private Limited","Hyderabad(Madhapur)","Recruitment- HR- hr executive- recruiter- technical recruiter","2018-03-20",0.0,2.0,125000.0,250000.0
"Opening for HR Business Partner Role Location - Bangalore","Opening for HR Business Partner Role Location - Bangalore","Health Care At Home India Pvt Ltd","Bengaluru(Adugodi)","hr- hrbp- business partnering- hr recruiter- human resource recruiter...","2018-03-20",3.0,6.0,250000.0,425000.0
"Head HR","Head HR","Viraj Projects India Pvt. Ltd.","Pune","senior hr- hr functions- PMS- C&B;- recruitment","2018-03-20",12.0,22.0,0.0,0.0
"Walking for Freshers HR Trainees for Bangalore Location (female)","Walking for Freshers HR Trainees for Bangalore Location (female)","Lumbini Elite Solutions  Services Pvt Ltd","Bengaluru","social media- communication skills- recruitment- website promotion...","2018-03-20",0.0,1.0,0.0,0.0
"Hr-executive Recruitment Process","Hr-executive Recruitment Process","Fortune HR Consultants","Chennai","Recruitment- HR- hr executive- fresher- fluent english- good communication-...","2018-03-21",0.0,5.0,125000.0,175000.0
"HR Operations / AON / Inbound Voice Process / Gurgaon /","HR Operations / AON / Inbound Voice Process / Gurgaon /","Prime HR Consultants","Gurgaon","hr operations- inbound voice process- international call center...","2018-03-21",0.0,2.0,250000.0,325000.0
"HR Executive / HR Generalist ( Human Resource ) HR Fresher - MNC","HR Executive / HR Generalist ( Human Resource ) HR Fresher - MNC","SLA Consultants India","Delhi NCR- Gurgaon- Noida","HR Executive- hr generalist- hr manager- hr officer- Payroll HR Executive...","2018-03-20",0.0,5.0,225000.0,550000.0
"International bpo Customer Service Executive HR Executive Trainee","International bpo Customer Service Executive HR Executive Trainee","ShiningStars Institutions and Travels Pvt. Ltd.","Delhi NCR- Jaipur","Customer Service- customer support- technical support...","2018-03-20",0.0,5.0,175000.0,400000.0
"Assistant Manager HR","Assistant Manager HR","REERACOEN INDIA PRIVATE LIMITED","Greater Noida","HR- Hiring- Human Resource Management","2018-03-20",6.0,11.0,600000.0,800000.0
"Hurry Job Openings For International Voice Process Call HR Sumeet","Hurry Job Openings For International Voice Process Call HR Sumeet","2Coms Consulting Pvt Ltd.","Pune","Customer Service- International Voice Process- Calling...","2018-03-20",0.0,5.0,150000.0,275000.0
"HR Recruiter","HR Recruiter","INN 3","Thane","recruitment- hr recruiter- talent acquisition- senior recruiter- staffing...","2018-03-20",0.0,5.0,0.0,0.0
"Immediate Offer/direct Walk-in for HR Recruiter-chennai Location","Immediate Offer/direct Walk-in for HR Recruiter-chennai Location","Sixsigma Softsolutions Private Limited","Chennai(Nungambakkam)","Hr Mba- HR- Mba Fresher- mba hr- Recruitment- staffing- talent acquisition-...","2018-03-20",0.0,0.0,150000.0,175000.0
"HR Generalist","HR Generalist","NRG Recruiter","Madurai","Recruitment- HR- Talent Acquisition- Onboarding- Compensation- Training...","2018-03-20",2.0,4.0,0.0,0.0
"HR Recruiter - Lateral Positions Recruitment","HR Recruiter - Lateral Positions Recruitment","The Corporate Ladders","Bengaluru(Bommenahalli)","HR- Recruitment- Aggressive- Communication Skills- Lateral Hiring...","2018-03-20",3.0,4.0,300000.0,350000.0
"Associates for HR -voice Process in a BPO at Noida","Associates for HR -voice Process in a BPO at Noida","ADVAIT CONSULTING","Delhi NCR","voice process- bpo- hr- hro- hr operations- human resource- recruitment...","2018-03-20",2.0,5.0,225000.0,350000.0
"Assistant Manager Hr(recruitment)-gurgaon","Assistant Manager Hr(recruitment)-gurgaon","Job Finder","Delhi NCR- Delhi- Gurgaon","Recruitment- HR- Human Resource Management- BPO Hiring...","2018-03-20",3.0,8.0,350000.0,550000.0
"HR Executive/recruitment Executive","HR Executive/recruitment Executive","Vision Corporate Management Services","Delhi NCR(Lado Sarai)","Recruitment- Sourcing- HR- Recruiter- technical recruiter- it recruiter...","2018-03-20",0.0,2.0,150000.0,300000.0
"HR Recruiter(volume Hiring)","HR Recruiter(volume Hiring)","Ziphertech","Navi Mumbai- Thane","recruitment- hr- selection process- sourcing- international bpo- domestic...","2018-03-20",0.0,3.0,150000.0,375000.0
"Senior HR Exe (female) for a Leading Business Consulting @ Gurgaon","Senior HR Exe (female) for a Leading Business Consulting @ Gurgaon","Anyonyam Consulting Services","Gurgaon(Civil Lines)","Recruitment- HR Generalist Activities- Non It- Business Consulting...","2018-03-20",3.0,6.0,325000.0,425000.0
"Senior HR Recruiter - Urgent Opening","Senior HR Recruiter - Urgent Opening","Techavera Solutions Pvt. Ltd.","Noida","HR Recruiter- IT Recruiter- hr executive- Human Resource Management...","2018-03-20",1.0,6.0,250000.0,500000.0
"Team Leader - HR (recruitment)","Team Leader - HR (recruitment)","Imaginators Try Going Beyond","Delhi NCR- Gurgaon","TL- Team Leading- Recruitment- HR- Team Leader HR- BPO Hiring","2018-03-21",2.0,7.0,350000.0,550000.0
"HR Coordinator_colaba_mnc_real Estate","HR Coordinator_colaba_mnc_real Estate","Obox HR Solutions Private Limited","Mumbai(Colaba)","HR- Organizational Development- Vendor Management","2018-03-20",0.0,3.0,100000.0,200000.0
"HR & Admin Executive- Female","HR & Admin Executive- Female","Talent  Corner HR Services Pvt Ltd","Bengaluru","hr administration- payroll- screening- admin executive- hr- human resource-...","2018-03-20",0.0,3.0,50000.0,200000.0
"Assistant Manager Hr/ir in Mumbai(bhiwandi)","Assistant Manager Hr/ir in Mumbai(bhiwandi)","Eshana HR Consultants","Mumbai","HR- IR- Administration- Human Resource Management- Liaison","2018-03-20",4.0,5.0,500000.0,550000.0
"HR Executive(female) for E-commerce Industry for Jamalpur Gurgaon.","HR Executive(female) for E-commerce Industry for Jamalpur Gurgaon.","OM HR SOLUTIONS","Gurgaon","Advanced Excel- Communication Skills- Excel- Computer- HR Executive","2018-03-20",0.0,1.0,150000.0,250000.0
"Senior Manager - Human Resources Talent Acquisition - COE","Senior Manager - Human Resources Talent Acquisition - COE","CORPORATE ACCESS","Pune","Recruitment- HR- Hiring- Talent Acquisition- Screening- Interviewing- Human...","2018-03-15",6.0,8.0,0.0,0.0
"National Head - Human Resources Talent Acquisition","National Head - Human Resources Talent Acquisition","CORPORATE ACCESS","Pune","Recruitment- HR- Campus Hiring- Talent Acquisition- RPO- Sourcing...","2018-03-15",10.0,15.0,0.0,0.0
"Urgent || HR - Recruitment || East Delhi || Alternate Saturday's OFF","Urgent || HR - Recruitment || East Delhi || Alternate Saturday's OFF","HR SOLUTIONS","Delhi","Recruitment- HR- Team Leading- sourcing- Client Servicing- human resource...","2018-03-19",0.0,5.0,0.0,0.0
"Immediate Hiring for HR Recruiter - Ahmedabad","Immediate Hiring for HR Recruiter - Ahmedabad","PeopleStrong HR Services Pvt. Ltd.","Ahmedabad","recruitment- interviewing- performance management- hiring...","2018-03-19",2.0,4.0,200000.0,300000.0
"Walkin for HR Recruiters for Gurgaon Location","Walkin for HR Recruiters for Gurgaon Location","PeopleStrong HR Services Pvt. Ltd.","Gurgaon","Recruitment- Screening- Interviewing- Sourcing- HR- Recruitment Executive...","2018-03-16",2.0,3.0,200000.0,300000.0
"HR Executive","HR Executive","ANRI SOLUTIONS HR SERVICES PVT LTD","Delhi NCR(Janakpuri)- Delhi","recruitment- shortlisting- head hunting- screening- selection- sourcing...","2018-03-15",0.0,2.0,200000.0,300000.0
"Urgent Hiring for HR Recruiter - Ahmedabad","Urgent Hiring for HR Recruiter - Ahmedabad","PeopleStrong HR Services Pvt. Ltd.","Ahmedabad","recruitment- interviewing- performance management- non it recruitment...","2018-03-15",2.0,4.0,200000.0,300000.0
"HR Trainee/assistant/recruiter/executive/associate/generalist/manager","HR Trainee/assistant/recruiter/executive/associate/generalist/manager","ARC","Delhi NCR- Ajmer- Jaipur","Joining Formalities- Salary- IS- ESI- IR- Resourcing- Cold calling...","2018-03-21",0.0,5.0,150000.0,650000.0
"Walk in Interview : HR Interns / HR Executive Malad (west)","Walk in Interview : HR Interns / HR Executive Malad (west)","Intellecta Consultants","Mumbai- Mumbai Suburbs","Internship- Part Time- Fresher- Freelance Recruiter- HR Executive...","2018-03-21",0.0,5.0,100000.0,250000.0
"HR Executive","HR Executive","Career Solutions","Bengaluru- Pune- Ahmednagar","HR Functions- Administration- Administrative Support- admin support...","2018-03-20",0.0,2.0,0.0,0.0
"Asst Manager  - HR Required Urgently","Asst Manager  - HR Required Urgently","Viraj Projects India Pvt. Ltd.","Pune","HR- Payroll- Human Resource Management","2018-03-20",5.0,9.0,0.0,0.0
"Director(HR)","Director(HR)","ITI Limited","Delhi",,"2018-03-20",,,25750.0,30950.0
"HR Benefits Administration Officer","HR Benefits Administration Officer","UBS Business Solutions (India) Pvt. Ltd.","Pune","HR Benefits Administration Officer- HR Benefits Administration...","2018-03-20",2.0,4.0,0.0,0.0
"HR Manager","HR Manager","ICON Clinical Research Technologies)","Chennai","HR Manager- HR- employee relation- people development- business partnering-...","2018-03-20",8.0,10.0,0.0,0.0
"walk In Drive for Data Analysis-mis (exel)@ Eclerx -HR Nikita Vaidya","walk In Drive for Data Analysis-mis (exel)@ Eclerx -HR Nikita Vaidya","eClerx Services Ltd.","Pune","vlookup- hlookup- excel- mis- mis reporting- ms office- mis preparation- BE...","2018-03-20",0.0,2.0,0.0,0.0
"HR Executive","HR Executive","ABU JANI SANDEEP KHOSLA","Mumbai","labour laws- industrial relations- labour relations- Payroll- ESIC- PF...","2018-03-20",3.0,8.0,200000.0,300000.0
"Sr. Officer / Executive - HR- Thol & Virochan Nagar Plant","Sr. Officer / Executive - HR- Thol & Virochan Nagar Plant","Troikaa Pharmaceuticals Ltd.","Ahmedabad(Sanand+1)","hr- induction- joining formalities- manpower planning- canteen management...","2018-03-20",2.0,4.0,0.0,0.0
"HR Admin Internship","HR Admin Internship","AgiVetta Consulting","Gurgaon","HR Administration- Data Entry- HR Intern- Internship- Excel","2018-03-20",0.0,0.0,0.0,0.0
"HR Executive Chakan","HR Executive Chakan","Pinnacle info services private limited","Aurangabad- Pune","Policies- HR- Procedures","2018-03-20",2.0,3.0,250000.0,275000.0
"Assistant Manager HR - Labour & Law","Assistant Manager HR - Labour & Law","Confidential","Delhi(Punjabi Bagh West)","Assistant Manager HR- hr manager","2018-03-20",7.0,10.0,0.0,0.0
"Wanted Biomedical Engineers for Medical Coder Position - Abinaya HR","Wanted Biomedical Engineers for Medical Coder Position - Abinaya HR","Core2Code","Chennai- Coimbatore- Vellore","medical coding- bds- bpt- nursing- gnm- botany- pharmacy- all life science-...","2018-03-21",0.0,0.0,175000.0,225000.0
"Assistant Professor (Contract) - Human Resources","Assistant Professor (Contract) - Human Resources","Indian Institute of Technology Kanpur","Kanpur",,"2018-03-20",,,7000.0,0.0
"HR Executive","HR Executive","KP HR AND INFRA SERVICES","Pune(Sector No-7 Bhosari)","PF- HR- ESI- Payroll- Salary","2018-03-20",2.0,4.0,125000.0,175000.0
"Assistant Professor - Human Resources","Assistant Professor - Human Resources","Indian Institute of Technology Kanpur","Kanpur",,"2018-03-20",3.0,5.0,3.0,15600.0
"Walk-in|corporate Hr(ta Profile) |centum Learning Ltd.","Walk-in|corporate Hr(ta Profile) |centum Learning Ltd.","Centum Learning Limited","Delhi NCR(Chattarpur)","recruitment- corporate hr- sourcing- vendor management- bulk hiring...","2018-03-16",4.0,9.0,400000.0,600000.0
"Superintendent (HR)","Superintendent (HR)","Kerala Public Service Commission","Kerala",,"2018-03-20",,,20740.0,36140.0
"Assistant Manager HR - Noida - Night Shift","Assistant Manager HR - Noida - Night Shift","Eye Care Leaders","Noida","HR Audit- Employee Engagement- Employee Grievances- HR Policies...","2018-03-21",2.0,7.0,0.0,0.0
"Executive - HR","Executive - HR","DefSys Solutions Pvt. Ltd.","Gurgaon","admin executive- facilities- housekeeping- facility management...","2018-03-20",1.0,3.0,0.0,0.0
"Walkin for HR Recruiter @ India Healthcare Solutions","Walkin for HR Recruiter @ India Healthcare Solutions","India Health Care Solutions Pvt Ltd","Chennai","Recruitment Executive- recruiter- it recruiter- hr executive- hr officer...","2018-03-15",1.0,2.0,125000.0,175000.0
"Manager HR & Administration","Manager HR & Administration","GeoEdge Technologies Pvt Ltd","Coimbatore","manager hr & administration- talent acquisition- recruitment management...","2018-03-19",6.0,9.0,0.0,0.0
"Sr. HR Recruiter","Sr. HR Recruiter","Sahajanand Laser Technology Ltd.","Gandhinagar","senior hr- selection- recruitment- conducting interviews- linkedin...","2018-03-19",2.0,6.0,250000.0,300000.0
"Senior HR Executive","Senior HR Executive","Kerry Indev Logistics Pvt Ltd","Chennai","HR Generalist Activities- Recruitment- Senior HR- Exit Formalities...","2018-03-19",3.0,5.0,0.0,0.0
"WALK IN Drive Graduate Trainee - HR / Marketing (guindy)","WALK IN Drive Graduate Trainee - HR / Marketing (guindy)","O&G; SKILLS INDIA PVT LTD","Chennai","recruitment- talent management- social marketing- hr- talent acquisition...","2018-03-19",0.0,1.0,125000.0,200000.0
"Openings @ Capita India for HR Executive ( IT )","Openings @ Capita India for HR Executive ( IT )","Capita India Pvt. Ltd","Pune","Recruitment- Talent Acquisition- HR- Leadership Hiring- Mass Hiring...","2018-03-19",1.0,2.0,0.0,0.0
"HR Recruiter and HR Executive(female Generalist HR)","HR Recruiter and HR Executive(female Generalist HR)","V2LOGIC SYSTEMS PRIVATE LIMITED","Chennai","Recruitment- HR- Talent Acquisition- Compensation- Onboarding- Interviewing...","2018-03-16",1.0,2.0,100000.0,300000.0
"HR Business Partner BU Media - Bangalore","HR Business Partner BU Media - Bangalore","Ericsson India Global Services Pvt. Ltd.","Bengaluru","HR Business Partner- ERP- MS Data management- MIS- Reports- HR Policies...","2018-03-19",10.0,12.0,0.0,0.0
"Vacancy II HR Associate || Authbridge","Vacancy II HR Associate || Authbridge","Auth Bridge Research Services Pvt. Ltd.","Gurgaon","recruitment- hr- joining formalities- screening- Sourcing- Consulting...","2018-03-15",1.0,2.0,250000.0,350000.0
"HR & Admin Executive","HR & Admin Executive","Savitri Telecom Services","Delhi NCR","Business HR- Recruitment- Employee Engagement- Employee Grievances...","2018-03-15",2.0,4.0,200000.0,300000.0
"HR Executive","HR Executive","Darshan Soft-Tech Pvt. Ltd","Vadodara","human resource management- recruitment management...","2018-03-15",2.0,3.0,300000.0,325000.0
"HR Manager","HR Manager","Sakshi Impex","Ludhiana","Recruitment- HR Budgeting- Employee Relations- Employee Grievances...","2018-03-15",3.0,8.0,0.0,0.0
"Senior HR Executive","Senior HR Executive","SCA eCode Solutions Pvt. Ltd.","Noida","HR Generalist Activities- Recruitment- Senior HR- Exit Formalities...","2018-03-15",2.0,4.0,225000.0,300000.0
"HR Executive","HR Executive","S & R Exports","Gurgaon","Recruitment- HR- Induction- Joining Formalities- Talent Acquisition...","2018-03-19",1.0,4.0,225000.0,350000.0
"Walk In Interview for Hr - Executive  (recruitment)","Walk In Interview for Hr - Executive  (recruitment)","Royaloak Incorporation Pvt Ltd","Bengaluru(Bethel Nagar+8)","Recruitment- Onboarding- HR- Hiring- Interviewing- Sourcing...","2018-03-19",1.0,3.0,0.0,0.0
"HR Recruiter","HR Recruiter","Expertscan Consultants Pvt Ltd","Ghaziabad","Recruitment- recruiter- Non IT Recruitment","2018-03-20",1.0,6.0,0.0,0.0
