"desig","details","org","loc","keyskills","date","expLow","expHigh","salLow","salHigh "
"Asst. Professor (HR)","Asst. Professor (HR)","Gandhi Group of Institutions","Gunupur- Dist Rayagada","Professor Activities- Teaching- Industrial Training- Business Management","2018-03-22",5.0,10.0,0.0,0.0
"Walk-in for the post of HR Executive - Compliance & Payroll Executive","Walk-in for the post of HR Executive - Compliance & Payroll Executive","Magic Holidays","Mumbai(Mahim United Industrial Estate)","HR- PF- Gratuity- ESIC- Payroll- Salary Processing- Leave- Attendance- PT...","2018-03-22",2.0,7.0,200000.0,325000.0
"Opening for Domestic Voice Process @ Thane- Hr Ashiya","Opening for Domestic Voice Process @ Thane- Hr Ashiya","Confidential","Mumbai- Mumbai Suburbs- Navi Mumbai","salary- technical voice process- us shift- communication skills...","2018-03-22",0.0,5.0,0.0,0.0
"Sutherland Hiring for International Voice Process Meet Hr Ashiya","Sutherland Hiring for International Voice Process Meet Hr Ashiya","Sutherland","Mumbai","international bpo- international voice process- verbal communication...","2018-03-22",0.0,5.0,175000.0,375000.0
"Opportunity for Travel Email Process Meet Hr Ashiya","Opportunity for Travel Email Process Meet Hr Ashiya","Sutherland Global Services Private Limited","Mumbai- Mumbai Suburbs- Navi Mumbai- Thane","Travel- Hiring- IATA- Email Process- Verbal Communication- English Language...","2018-03-22",0.0,5.0,100000.0,275000.0
"Wipro Hiring for International Airlines in Powai HR Tejal","Wipro Hiring for International Airlines in Powai HR Tejal","Wipro BPS","Mumbai- Mumbai Suburbs","airlines- iata- voice process- international bpo- voice...","2018-03-22",0.0,3.0,0.0,0.0
"Jr. HR Officer at GGI Gunupur","Jr. HR Officer at GGI Gunupur","Vidya Bharati Educational Trust","Gunupur Rayagada","Education and Teaching- Odisha- JR HR Officer- JR HR MANAGER...","2018-03-22",2.0,3.0,175000.0,300000.0
"Wipro is Hiring for International Airlines @ Powai HR Tejal","Wipro is Hiring for International Airlines @ Powai HR Tejal","Wipro BPS","Mumbai- Mumbai Suburbs","airlines- iata- international bpo- travel process- travel- reservation- cse...","2018-03-22",0.0,3.0,0.0,0.0
"Intern ( HR )","Intern ( HR )","Energo Engineering Projects Ltd","Delhi NCR","Excel- Word- MS Office- HR","2018-03-22",0.0,1.0,0.0,0.0
"Mega Drive for Freshers and Experience at Wipro Mumbai!! HR Pratika","Mega Drive for Freshers and Experience at Wipro Mumbai!! HR Pratika","Wipro Ltd","Mumbai- Mumbai Suburbs","Airlines- IATA- Verbal Communication- Voice Process- travel...","2018-03-22",0.0,5.0,0.0,0.0
"Wipro is Hiring for Logistics Process- Sat/sun Fixed OFF - HR Khushboo","Wipro is Hiring for Logistics Process- Sat/sun Fixed OFF - HR Khushboo","Wipro BPS","Mumbai- Mumbai Suburbs","voice process- international bpo- voice- cse- csa- csr- wipro- logistics...","2018-03-22",0.0,3.0,0.0,0.0
"Wipro Hiring for CHAT & Email Process HR Khushboo Jain","Wipro Hiring for CHAT & Email Process HR Khushboo Jain","Wipro BPS","Mumbai- Mumbai Suburbs","international bpo- travel process- cse- csa- csr- Email Process- Chat...","2018-03-22",0.0,3.0,0.0,0.0
"Wipro Hiring for International Airlines in Powai HR Khushboo","Wipro Hiring for International Airlines in Powai HR Khushboo","Wipro BPS","Mumbai- Mumbai Suburbs","airlines- iata- voice process- international bpo- voice...","2018-03-22",0.0,3.0,0.0,0.0
"Wipro Hiring for International Airlines in Powai HR Rachel (non-voice)","Wipro Hiring for International Airlines in Powai HR Rachel (non-voice)","Wipro BPS","Mumbai- Mumbai Suburbs- Navi Mumbai- Thane","airlines- iata- international bpo- voice- reservation & ticketing executive...","2018-03-22",0.0,5.0,0.0,0.0
"Wipro Hiring for International Airlines in Powai HR Rachel","Wipro Hiring for International Airlines in Powai HR Rachel","Wipro BPS","Mumbai- Mumbai Suburbs- Navi Mumbai- Thane","airlines- iata- voice process- international bpo- voice...","2018-03-22",0.0,5.0,0.0,0.0
"HR Executive Talent Acquisition","HR Executive Talent Acquisition","GGA India Private Limited","Gurgaon(Udyog Vihar)","Recruitment- Shortlisting- Talent Acquisition- HR- Sourcing","2018-03-22",2.0,5.0,150000.0,250000.0
"Senior HR Executive","Senior HR Executive","Tiol Private Limited TAX INDIA ONLINE.COM PRIVATE LTD.","Gurgaon","Senior HR- senior recruitment- senior talent acquisition","2018-03-22",2.0,4.0,0.0,0.0
"HR IT Recruiter Needed Urgently","HR IT Recruiter Needed Urgently","Greenleap Inspirations Consulting services LLP","Bengaluru","it recruitment- erp- crm- hr executive- us it recruitment- it staffing...","2018-03-22",3.0,4.0,425000.0,500000.0
"HR Executive Talent Acquisition","HR Executive Talent Acquisition","Competent Synergies Pvt. Ltd.","Chandigarh- Mohali","hr- talent acquisition- Recruitment- HR Executive- Recruitment Executive","2018-03-22",1.0,5.0,100000.0,200000.0
"HR Manager - Coimbatore (very Urgent)","HR Manager - Coimbatore (very Urgent)","AAR KAY MANAGEMENT CONSULTANTS","Coimbatore","Hr Mba- Recruitment- Human Resource Management- Salary- Presentation Skills","2018-03-22",5.0,6.0,350000.0,500000.0
"HR Professional","HR Professional","B3-BRAIN BEHIND BRAND","Kalyani","Recruitment- HR- Performance Appraisal- Training- Competency Mapping...","2018-03-22",2.0,4.0,0.0,0.0
"Mega Walkin: Hiring Freshers for HR Operations (US Shift) Bangalore","Mega Walkin: Hiring Freshers for HR Operations (US Shift) Bangalore","Artech Infosystems Pvt. Ltd.","Bengaluru","us staffing- us recruiter- night shift- us it staffing- technical recruiter...","2018-03-22",0.0,2.0,0.0,0.0
"Urgent Opening for HR Generalist /specialist in Leading Company","Urgent Opening for HR Generalist /specialist in Leading Company","Enrich and Enlight","Chennai","Recruitment- HR Generalist Activities- HR Operations- BPO...","2018-03-22",2.0,7.0,200000.0,450000.0
"Urgent Opening for HR Generalist /specialist in Leading Company","Urgent Opening for HR Generalist /specialist in Leading Company","Enrich and Enlight","Chennai","Recruitment- HR Generalist Activities- HR Operations- BPO...","2018-03-22",2.0,7.0,200000.0,450000.0
"Urgent Position: - Hr(recruitment Executive) only Females-bangalore","Urgent Position: - Hr(recruitment Executive) only Females-bangalore","Headhunterz","Bengaluru","Recruitment- HR Policies- Screening- Interview Coordination- Head Hunting...","2018-03-22",2.0,5.0,0.0,0.0
"Urgent Opening for HR Generalist /specialist in Leading Company","Urgent Opening for HR Generalist /specialist in Leading Company","Enrich and Enlight","Chennai","Recruitment- HR Generalist Activities- HR Operations- BPO...","2018-03-22",2.0,7.0,200000.0,450000.0
"Urgent Opening for Hr Recruiter for Thane Location","Urgent Opening for Hr Recruiter for Thane Location","Human Forte","Thane","recruitment- telephonic- screening- interviewing- hr- searching...","2018-03-22",1.0,3.0,0.0,0.0
"HR Recruiter (walkin Interview)","HR Recruiter (walkin Interview)","M/S Maxima Executive Search Pvt Ltd","Bengaluru","Recruitment- Screening- Sourcing- Industry Mapping- Telephonic- HR...","2018-03-22",1.0,2.0,0.0,0.0
"Senior Supervisor - Human Resource - Leading Fashion Retail Brand.","Senior Supervisor - Human Resource - Leading Fashion Retail Brand.","Smart Source","Hyderabad","recruitment- acquisition- budget- engagement- policies- process- processes-...","2018-03-22",3.0,8.0,500000.0,700000.0
"HR Manager (generalist)","HR Manager (generalist)","ManpowerGroup Services India Private Limited","Hyderabad","Recruitment- HR Policies- Training Needs- Human Resource Management...","2018-03-22",5.0,8.0,0.0,0.0
"Hr- Recruiter Female || Urgent Hiring For Hr- Executive / Recruiter.","Hr- Recruiter Female || Urgent Hiring For Hr- Executive / Recruiter.","Career Empower","Delhi NCR(East Patel Nagar)- Delhi","Hr Recruiter- Human Resource- Administration- Recruitments- Staffing...","2018-03-22",0.0,3.0,150000.0,225000.0
"Sr.executive Human Resource (vithalapur Gujarat)","Sr.executive Human Resource (vithalapur Gujarat)","INNOVATION TRIGGERS MGMT PRIVATE LIMITED","Ahmedabad","HR Processes- Employee Engagement- Talent Management- Talent Acquisition...","2018-03-22",3.0,5.0,300000.0,500000.0
"HR Executive at Vile Parle (E).","HR Executive at Vile Parle (E).","Job Search","Mumbai","HR- HR Generalist- human resource- recruitment- recruiter- Administration...","2018-03-22",2.0,7.0,200000.0,300000.0
"HR Manager - Chennai (very Urgent)","HR Manager - Chennai (very Urgent)","AAR KAY MANAGEMENT CONSULTANTS","Chennai","recruitment- human resource management- salary- presentation skills","2018-03-22",8.0,10.0,350000.0,500000.0
"HR Executive","HR Executive","PlatOz HR Pvt Ltd","Thane","Recruitment- HR- Salary Negotiation","2018-03-22",0.0,5.0,0.0,0.0
"Senior HR Recruiter / Team Lead - IT & NON IT !! Work Location - Pune","Senior HR Recruiter / Team Lead - IT & NON IT !! Work Location - Pune","HR Remedy India","Pune- Indore- Kolhapur","hr- recruitment- hiring- bulk hiring- volume hiring- volume recruitment...","2018-03-22",1.0,2.0,175000.0,300000.0
"Walk-in! HR Recruiter @ Genesis HR Services @ Aundh /wakad","Walk-in! HR Recruiter @ Genesis HR Services @ Aundh /wakad","Genesis HR Services","Pune","hr- hiring- sourcing- client handling- communication skills- genesis...","2018-03-22",0.0,2.0,70000.0,225000.0
"HR Executive","HR Executive","Lianchuang Hongsheng India Pvt Ltd","Noida","HR- Recruitment- Attendance Management- Administration","2018-03-22",2.0,3.0,0.0,0.0
"Urgent Opening for HR Intern","Urgent Opening for HR Intern","Prime Focus Technologies Ltd","Bengaluru(Bellandur)","hr intern- HR Trainee- Recruitment Trainee- Mba Hr Fresher","2018-03-22",0.0,0.0,0.0,0.0
"HR Recruiter/ Senior Hr Recruiter - West Delhi","HR Recruiter/ Senior Hr Recruiter - West Delhi","Imaginators Try Going Beyond","Delhi NCR","Recruitment- HR- Recruitment Executive- HR Recruiter- hr executive...","2018-03-22",0.0,5.0,125000.0,275000.0
"Walk Ins for HR- Recruiter (exp-2-4 Yrs) Only for Immediate Joiner","Walk Ins for HR- Recruiter (exp-2-4 Yrs) Only for Immediate Joiner","MPS Ltd.","Noida","Recruitment- Interviewing- HR- Non It","2018-03-22",2.0,4.0,300000.0,325000.0
"HR Executive","HR Executive","Ajoite Technology Pvt. Ltd","Noida(Sector-63 Noida)","hiring- office administration- office admin- recruitment- hr...","2018-03-22",0.0,2.0,0.0,0.0
"HR Coordinator Profile- Okhla/ Gurgaon","HR Coordinator Profile- Okhla/ Gurgaon","Imaginators Try Going Beyond","Delhi NCR(Okhla)- Gurgaon(Udyog Vihar)","HR Coordination- Hiring- Sourcing- Recruiter- bpo- international bpo- Voice...","2018-03-22",0.0,2.0,100000.0,225000.0
"Trainees/ Freshers- Human Resource","Trainees/ Freshers- Human Resource","MNC","Mumbai","HRMS- Recruitment","2018-03-22",0.0,1.0,325000.0,650000.0
"Opening with a Leading Education Industry for Manager Human Resource","Opening with a Leading Education Industry for Manager Human Resource","Propeller & Navigator","Jaipur","human resource- hr generalist- Talent Acquisition- Talent Management...","2018-03-22",8.0,13.0,0.0,0.0
"HR Recruiter & Generalist","HR Recruiter & Generalist","Osprosys Software Pvt Ltd","Bengaluru(Whitefield)","recruitment- interview coordination- screening- hr generalist activities...","2018-03-22",0.0,2.0,0.0,0.0
"TATA BSS Hiring!! HR Executive","TATA BSS Hiring!! HR Executive","TATA Business Support Services Ltd.","Bengaluru(Electronic City)","employee engagement- grievance handling- employee relations- hr operations-...","2018-03-22",0.0,5.0,0.0,0.0
"Executive - HR","Executive - HR","Shahi Exports Pvt Ltd.","Bengaluru","Recruitment- Head Hunting- Salary Negotiation- HR- Hiring...","2018-03-22",2.0,5.0,0.0,0.0
"Opening for HR Manager_smart Brains Engineers_noida","Opening for HR Manager_smart Brains Engineers_noida","Smartbrains Consultants","Noida","recruitment- payroll- hr- Employee Engagement- PF- ESIC- Exit Management...","2018-03-22",3.0,7.0,300000.0,400000.0
"Urgent Hiring for HR Executive in Wizard Group(direct Payroll)","Urgent Hiring for HR Executive in Wizard Group(direct Payroll)","Wizard E Marketing Pvt Ltd","Kolkata","hiring- hr- bpo recruitment- recruitment executive- recruiter- HR Recruiter...","2018-03-22",1.0,4.0,125000.0,250000.0
"HR Executive","HR Executive","Aircruise Travels Pvt Ltd","Delhi(Lajpat Nagar)","HR Policies- Exit Interviews- Screening- Interpersonal Skills- HR Executive...","2018-03-22",1.0,6.0,150000.0,250000.0
"Mphasis Hiring for International Voice Processcontact- HR Soniya","Mphasis Hiring for International Voice Processcontact- HR Soniya","Mphasis Limited","Pune","International Voice Process- US Shift- Communication Skills...","2018-03-22",0.0,4.0,200000.0,300000.0
"Asst Manager HR for Bhilai only male","Asst Manager HR for Bhilai only male","Shree Vibgyor Color Lab","Bhilai/Bhillai","Recruitment- Hr Solutions- Human Resource Management...","2018-03-22",1.0,2.0,150000.0,250000.0
"Senior Associate Human Resources","Senior Associate Human Resources","Ciena India Private Ltd.","Gurgaon","HR Operations- Employee Engagement- Hrbp- Talent Management...","2018-03-22",2.0,4.0,0.0,0.0
"HR Executive - Mumbai (only Women)","HR Executive - Mumbai (only Women)","all for kids","Mumbai- Mumbai Suburbs","Recruitment and Staffing","2018-03-22",0.0,5.0,0.0,0.0
"Assistant Manager HR - Delhi/ncr/faridabad","Assistant Manager HR - Delhi/ncr/faridabad","ELI India","Delhi NCR- Faridabad","HR Audit- Employee Engagement- Employee Grievances- HR Policies...","2018-03-22",2.0,5.0,0.0,0.0
"HR Head / GM HR","HR Head / GM HR","Macons Equipments Pvt. Ltd.","Ahmedabad","Recruitment- HR- Human Resource Management",,,,,
"Not disclosed","2018-03-22","15","25","0",,,,,
"Sr. HR Executive","Sr. HR Executive","Aron Universal Ltd.","Bengaluru(Jigani)","non it recruitment- HR Recruiter- Recruitment Executive- Non IT Recruiter...","2018-03-22",5.0,8.0,0.0,0.0
"Human Resource And Recruitment Officers To Be Placed Overseas","Human Resource And Recruitment Officers To Be Placed Overseas","Countrywide Immigration Private Limited","Australia- Canada- Hong Kong","HR and Recruitment and IR- HR Manager","2018-03-22",2.0,7.0,65000.0,80000.0
"HR Recruiter & Generalist - Female  - Koramangala","HR Recruiter & Generalist - Female  - Koramangala","31West Global Services","Bengaluru","hiring- hr- human resource- hr executive- hr recruiter...","2018-03-22",1.0,4.0,225000.0,250000.0
"HR Benefits/hr Operations-ntt Data-gurgaon","HR Benefits/hr Operations-ntt Data-gurgaon","Sourcing Valley","Delhi NCR- Gurgaon","benefits- hr operations- communication skills- HR Trainee...","2018-03-22",0.0,2.0,150000.0,350000.0
"HR Manager for a Reputed Hospital","HR Manager for a Reputed Hospital","IFANglobal India Pvt. Ltd.","Delhi NCR","HR Generalist Activities- Human Resource Management","2018-03-22",4.0,7.0,400000.0,600000.0
"Urgent Opening - HR Executive- Female","Urgent Opening - HR Executive- Female","ManpowerGroup Services India Private Limited","Hyderabad","HR- HR Generalist Activities- hr executive activities...","2018-03-22",1.0,2.0,125000.0,175000.0
"Job Opening for HR Generalist/operation with Leading Company Navallur","Job Opening for HR Generalist/operation with Leading Company Navallur","Enrich and Enlight","Chennai","hr administration- statutory compliance- HR Generalist- HR Assistance...","2018-03-22",3.0,8.0,200000.0,425000.0
"SAP FICO | SAP SD | SAP PP | SAP MM | SAP PM | SAP HR - 3-6 L PA","SAP FICO | SAP SD | SAP PP | SAP MM | SAP PM | SAP HR - 3-6 L PA","SLA Consultants India","Delhi NCR- Gurgaon- Noida","sap- sap crm- sap end user- sap crm end user- sap basis end user- fresher...","2018-03-22",0.0,5.0,225000.0,500000.0
"HR Business Partner","HR Business Partner","Veda Corporate Services","Bengaluru- Ahmedabad","HR Business Partner","2018-03-22",3.0,8.0,1200000.0,1800000.0
"Manager HR","Manager HR","Upman Placements Pvt Ltd","Mumbai","hr- mass hiring- human resource management- Bulk Hiring- HR Analytics...","2018-03-22",4.0,9.0,0.0,0.0
"Currently Hiring for the Position of HR Executive @ Chembur","Currently Hiring for the Position of HR Executive @ Chembur","Integrated Personnel Services Pvt Ltd","Navi Mumbai- Thane","hr- human resource- hr executive- hr generalist- hr operations...","2018-03-22",1.0,5.0,100000.0,250000.0
"HR Head: Taloja Mumbai.  (very Urgent)","HR Head: Taloja Mumbai.  (very Urgent)","AAR KAY MANAGEMENT CONSULTANTS","Mumbai","HR","2018-03-22",15.0,18.0,0.0,0.0
"General Manager HR : Lucknow","General Manager HR : Lucknow","AAR KAY MANAGEMENT CONSULTANTS","Lucknow","hr- human resource management- general management","2018-03-22",18.0,20.0,1000000.0,1200000.0
"Hiring for HR Consultant HR Executive (vikaspuri)","Hiring for HR Consultant HR Executive (vikaspuri)","Expert Staffing Solutions","Delhi(Vikas Puri)","recruitment- mba hr- hr executive- mba fresher- bulk hiring- consultant...","2018-03-22",0.0,2.0,70000.0,225000.0
"Hiring for HR Executive (vikaspuri)","Hiring for HR Executive (vikaspuri)","Expert Staffing Solutions","Delhi(Vikas Puri)","recruitment- mba hr- hr executive- mba fresher- bulk hiring- consultant...","2018-03-22",0.0,2.0,70000.0,225000.0
"HR Recruiter - ( Male )","HR Recruiter - ( Male )","MARS Placements Services","Delhi(Kotla)","Recruitment- Hiring- HR- Staffing- resourcing- talent acquisition","2018-03-22",2.0,4.0,250000.0,300000.0
"HR Fresher Opening | Location: Mumbai | Salary: 10 K + Incentives","HR Fresher Opening | Location: Mumbai | Salary: 10 K + Incentives","Hindco Recruitment Consultants","Mumbai- Mumbai Suburbs","B.Com Fresher- BMS Fresher- B.Sc. Fresher- HR Fresher- Human Resource...","2018-03-22",0.0,1.0,0.0,0.0
"MBA Fresher | HR Recruiter | Location: Mumbai | Salary: 10 K to 12 K","MBA Fresher | HR Recruiter | Location: Mumbai | Salary: 10 K to 12 K","Hindco Recruitment Consultants","Mumbai- Mumbai Suburbs","Mba Fresher- MBA HR- HR- Human Resource- Recruitment- Staffing- Hiring...","2018-03-22",0.0,1.0,0.0,0.0
"Urgent Opening for HR Recruiters (females Only) in Alwarpet","Urgent Opening for HR Recruiters (females Only) in Alwarpet","Beerana Consultancy Services","Chennai(Alwarpet+1)","screening- telephonic- hr- sourcing- scheduling- offer- manpower...","2018-03-22",0.0,5.0,125000.0,150000.0
"Hiring Hr Recruiter For FMCG Domain Contact Neha","Hiring Hr Recruiter For FMCG Domain Contact Neha","Universal Staffing Service","Delhi","recruitment- hiring- HR Recruiter- Fmcg hiring- fmcg recruitment...","2018-03-22",5.0,10.0,350000.0,750000.0
"Talent Acquisition Executive / Hr Executive / Recruitment Executive","Talent Acquisition Executive / Hr Executive / Recruitment Executive","Conviction Global","Mumbai- Thane- Mumbai Suburbs","recruitment- hr- human resource management- hr recruiter...","2018-03-22",0.0,5.0,100000.0,300000.0
"Hiring For Hr Recruiter/sr.hr Recruiter/team Leader/manger","Hiring For Hr Recruiter/sr.hr Recruiter/team Leader/manger","Universal Staffing Service","Delhi","hr- HR Recruiter- day shift- fresher- Mba Fresher- Hr Fresher- Recruitment-...","2018-03-22",0.0,4.0,175000.0,550000.0
"HR Recruiter/recruitment Executive for Noida Location","HR Recruiter/recruitment Executive for Noida Location","SD Solutions","Noida- Delhi NCR","recruitment- screening- interviewing- sourcing- hr- Mba Fresher- Hr Fresher...","2018-03-22",0.0,3.0,50000.0,200000.0
"HR Recruiter - BFSI Vertical","HR Recruiter - BFSI Vertical","Suvidha Placements Limited","Kolkata","Recruitment Consulting- MIS Reporting- hunting- screening- sourcing cvs...","2018-03-22",1.0,3.0,90000.0,150000.0
"HR Recruiter - Finance Company(male Immediate Joinee)","HR Recruiter - Finance Company(male Immediate Joinee)","Accu Edge Consultancy Services","Mumbai(Nariman Point)","recruitment- Talent Acquisition","2018-03-22",1.0,6.0,125000.0,200000.0
"Urjent Openings for HR Executive Operation","Urjent Openings for HR Executive Operation","TALENTPRO INDIA HR PRIVATE LIMITED","Delhi NCR","HR Generalist Activities- HR Operations- Human Resource Management","2018-03-22",2.0,5.0,175000.0,250000.0
"HR Executive | HR Manager| HR Generalist| Payroll| Compliance","HR Executive | HR Manager| HR Generalist| Payroll| Compliance","Grabit HR","Delhi NCR- Delhi- Gurgaon- Faridabad- Sonepat- Panipat","HR Generalist Activities- Bonus- Gratuity- Payroll- General Administration-...","2018-03-22",0.0,3.0,200000.0,400000.0
"HR Executive | HR Manager| HR Generalist| Payroll| Compliance","HR Executive | HR Manager| HR Generalist| Payroll| Compliance","Grabit HR","Delhi NCR- Delhi- Greater Noida- Noida- Ghaziabad- Meerut","HR Generalist Activities- Bonus- Gratuity- Payroll- General Administration-...","2018-03-22",0.0,3.0,200000.0,400000.0
"HR Executive| Sr. Executive|hr Generalist | Payroll Executive(bba/mba)","HR Executive| Sr. Executive|hr Generalist | Payroll Executive(bba/mba)","ASA HR Management","Delhi- Faridabad- Ghaziabad- Greater Noida- Gurgaon- Noida","HR Generalist Activities- General Administration- Payroll Processing...","2018-03-22",0.0,3.0,0.0,0.0
"HR Executive","HR Executive","Wisdmlabs","Mumbai","campus recruitment- employee orientation- hr- background verification...","2018-03-21",1.0,2.0,0.0,0.0
"Opening for HR Recruiter in Gurgaon","Opening for HR Recruiter in Gurgaon","AWP ASSISTANCE (INDIA) PRIVATE LIMITED","Gurgaon","recruitment- job posting- interviewing- sourcing- employee referral- campus...","2018-03-21",0.0,5.0,0.0,0.0
"Need: HR Executive : TA : (1-2 Yrs) : Gurgaon : Vinove Softwares Ltd.","Need: HR Executive : TA : (1-2 Yrs) : Gurgaon : Vinove Softwares Ltd.","Vinove Overseas","Delhi NCR","it recruitment- hr generalist activities- shortlisting- screening...","2018-03-21",1.0,2.0,100000.0,250000.0
"Walk In | HR Executive / Sr. Executive ( Recruitment ) | Noida","Walk In | HR Executive / Sr. Executive ( Recruitment ) | Noida","VirtualEmployee Pvt. Ltd","Noida","Recruitment- IT Recruitment- technical recruitment- Talent Acquisition...","2018-03-21",2.0,5.0,0.0,0.0
"HR Executive","HR Executive","Naveen Merico Engineering Co Pvt Ltd","Mumbai- Kolkata","PF- ESIC- P Tax- HR- TDS- Salary- Attendance- Human Resource Management- HR...","2018-03-22",4.0,9.0,250000.0,350000.0
"Executives (E1 level through UGC NET July 2018) - Human Resource Executive","Executives (E1 level through UGC NET July 2018) - Human Resource Executive","Oil And Natural Gas Corporation Limited","India",,"2018-03-22",,,60000.0,180000.0
"Accounts and HR Officer","Accounts and HR Officer","Sports & Youth Affairs Dept Odisha","Bhubaneshwar",,"2018-03-22",,,40000.0,45000.0
"Dy. Manager (M-4 Grade) - Human Resource Development","Dy. Manager (M-4 Grade) - Human Resource Development","National Mineral Development Corporation Ltd","Hyderabad",,"2018-03-22",,,70000.0,200000.0
"Hiring Fresher- International Voice - Contact HR Pavithra","Hiring Fresher- International Voice - Contact HR Pavithra","Novigo Integrated Services Private Limited","Chennai(Ekkaduthangal)","us healthcare- fresher- bpo- ar calling- ar caller- kpo- Medical Billing","2018-03-22",0.0,1.0,0.0,0.0
"Hr Fresher","Hr Fresher","ALIVE TECH SERVICES","Nagpur","Hr Fresher- Communication Skills","2018-03-22",0.0,0.0,0.0,0.0
"Work with MNC Comapany as a Marketing/ BDE Profile . Call HR Manish","Work with MNC Comapany as a Marketing/ BDE Profile . Call HR Manish","UNITED CAPITAL CLUB","Delhi NCR- Chandigarh- Gurgaon","Marketing- Bde- business development executive- marketing executive...","2018-03-22",0.0,4.0,200000.0,550000.0
"Academic Associate - Organizational Behavior & Human Resource Management","Academic Associate - Organizational Behavior & Human Resource Management","Indian Institute of Management Indore","Mumbai",,"2018-03-22",,,0.0,0.0
"HR Recruiter (fresher) - IT Domain","HR Recruiter (fresher) - IT Domain","ORBIT IT HR Solutions","Ahmedabad- Vadodara- Surat","recruitment- screening- interview coordination- hr- sourcing- interviewing-...","2018-03-21",0.0,5.0,0.0,0.0
"Manager - HR Taloja Mumbai.  (very Urgent)","Manager - HR Taloja Mumbai.  (very Urgent)","AAR KAY MANAGEMENT CONSULTANTS","Mumbai","HR- IR","2018-03-22",8.0,10.0,500000.0,600000.0
"HR Co-ordinator- Females Only- AGE NO BAR- Freshers / Exprinces","HR Co-ordinator- Females Only- AGE NO BAR- Freshers / Exprinces","SRI RAJARAJESHWARI AND CO.","Bengaluru","Recruitment- Orientation- Induction- HR- Interviewing- Sourcing","2018-03-22",1.0,6.0,0.0,0.0
"HR Executive","HR Executive","Mothers Pride","Delhi","Hr Mba- Exit Process- Salary- HR- recruitment","2018-03-21",2.0,6.0,0.0,0.0
"HR Recruiter BPO Walk in 26th & 27th March Gurgaon","HR Recruiter BPO Walk in 26th & 27th March Gurgaon","Creative Indians","Gurgaon","Recruitment- HR- HR Recruiter- human resource recruiter...","2018-03-22",2.0,6.0,400000.0,450000.0
"HR Recruiter","HR Recruiter","Eureka Forbes Ltd","Hyderabad(Ameerpet)","Recruitment- Shortlisting- Interviewing Candidates- HR- Screening- Sourcing...","2018-03-21",0.0,1.0,0.0,0.0
"Assistant Manager / Manager HR","Assistant Manager / Manager HR","Logicon Facility Management Pvt. Ltd.","Pune(Baner)","HR Operations- Employee Engagement- PMS- Talent Acquisition- Training...","2018-03-22",6.0,11.0,450000.0,950000.0
"HR Recruiter","HR Recruiter","Sitel India Pvt Ltd","Gurgaon","Recruitment- human resource- Bulk Hiring","2018-03-21",0.0,2.0,200000.0,250000.0
"HR Recruiter","HR Recruiter","Jobline Consultants India Pvt. Ltd.","Delhi NCR(AD Block Pitampura)","recruitment- hr recruiter- hr consultant- recruiter- recruitment executive-...","2018-03-22",0.0,3.0,0.0,0.0
"Head of HR and Recruitment","Head of HR and Recruitment","Lex innova","Gurgaon","HR Policies- Recruitment- Employee Engagement- Employee Grievances...","2018-03-21",8.0,13.0,0.0,0.0
"HR Recruiter Int. and External -  HR Payroll in BIg Companies Placing.","HR Recruiter Int. and External -  HR Payroll in BIg Companies Placing.","Techpark Recruiters","Bengaluru(BTM Layout)","Recruitment- Shortlisting- Screening- Sourcing- HR- Conducting Interviews...","2018-03-22",0.0,5.0,150000.0,600000.0
