"desig","details","org","loc","keyskills","date","expLow","expHigh","salLow","salHigh "
"HR Executive","HR Executive","Shaleen management consultants private limited","Jodhpur","HR Executive- HR- admin- recruitment administration","2018-03-21",1.0,5.0,0.0,0.0
"HR Executive","HR Executive","Shaleen management consultants private limited","Ajmer","HR Administration- Recruitment- Leave- Attendance- Salary Preparation","2018-03-21",1.0,5.0,0.0,0.0
"HR Manager - Udaipur","HR Manager - Udaipur","Shaleen management consultants private limited","Udaipur","HR- Training- Human Resource Management- Placement- Human Resource- Admin &...","2018-03-21",10.0,15.0,0.0,0.0
"HR Manager","HR Manager","Shaleen management consultants private limited","Udaipur","HR- Training- Human Resource Management- Placement- Human Resource- Admin &...","2018-03-21",10.0,15.0,0.0,0.0
"HR Executive in Recruitment | Day Shift","HR Executive in Recruitment | Day Shift","Talent Organizers","Delhi NCR","recruitment- hr- hr executive- day shift- cce- bpo- consultancy- fresher...","2018-03-21",0.0,5.0,250000.0,400000.0
"Interview for Hr Recruitertelecounceller only Females","Interview for Hr Recruitertelecounceller only Females","ACS","Pune- Jaipur- Vadodara","hr- counsellor- councellor- tele caller- tele sales- inbound selling...","2018-03-21",0.0,5.0,50000.0,175000.0
"LADY Freelance HR Recruiter","LADY Freelance HR Recruiter","R and S Corp","Bengaluru(Vidyaranyapura+2)","Recruitment- HR- Sourcing- Freelancing- Life Cycle","2018-03-21",1.0,6.0,100000.0,300000.0
"HR Executive","HR Executive","Trove Consulting Private Limited","Lucknow","fresher- bcom- bca- bba- recruitment- fresher- hr- bpo- telecallers...","2018-03-21",0.0,3.0,175000.0,250000.0
"Certification Courses IN HR For Fresher AT NAVI Mumbai With Placement","Certification Courses IN HR For Fresher AT NAVI Mumbai With Placement","Seven Consultancy","Mumbai- Navi Mumbai","HR- Recruitment- Gratuity- Payroll Management- Compensation- ESI- Portal","2018-03-21",0.0,5.0,50000.0,150000.0
"HR Recruiter (non-it) & HR - Lead (IT & Non-it Both)","HR Recruiter (non-it) & HR - Lead (IT & Non-it Both)","Unison International Consulting Pvt. Ltd","Gurgaon","Recruitment- HR- Non It- recruiter","2018-03-21",2.0,7.0,600000.0,1400000.0
"Walk-in - HR Internship - Will Provide Certificate with seal & Sign.","Walk-in - HR Internship - Will Provide Certificate with seal & Sign.","Zuiver Consultancy","Chennai","Recruitment- Head Hunting- Telephonic- HR- Sourcing- Conducting Interviews-...","2018-03-21",0.0,0.0,0.0,0.0
"Assistant / Deputy Manager HR","Assistant / Deputy Manager HR","Executive Tracks Associates (P) Ltd.","Ludhiana- Bhubaneshwar- Ranchi","HR Functions- Recruitment- Human Resource Management- Training- HRIS...","2018-03-21",6.0,10.0,500000.0,700000.0
"Assistant Manager HR","Assistant Manager HR","Bright Future Consultancy","Manesar","Recruitment- HR- Salary Negotiation- Human Resource Management...","2018-03-21",5.0,8.0,0.0,0.0
"Hiring For HR Recruiter In Jadavpur Location","Hiring For HR Recruiter In Jadavpur Location","Square 1 Consulting Services","Kolkata","excel- word- hr recruiter- hr consultant- Data Collection- Sendmail","2018-03-21",0.0,1.0,50000.0,70000.0
"HR Manager","HR Manager","Emerald Management Services","Chandigarh","hr manager- hr executive- recruitment executive- hr administration- Hr Mba","2018-03-21",3.0,7.0,0.0,0.0
"HR Recruiter (hindi Mandatory)","HR Recruiter (hindi Mandatory)","Computer Age Management Services Pvt. Ltd.","Chennai","Recruitment- HR- hr executive- recruiter","2018-03-20",1.0,2.0,0.0,0.0
"HR Recruiter","HR Recruiter","Makonis software Solutions Private Limited","Bengaluru","HR Recruiter- recruitment executive","2018-03-21",2.0,5.0,0.0,0.0
"HR Recruiter","HR Recruiter","Eureka Forbes Ltd","Nagpur- Jalgaon- Akola","Recruitment- Shortlisting- Interviewing Candidates- HR- Screening- Sourcing...","2018-03-20",0.0,1.0,0.0,0.0
"Hiring Hr Executive/ Hr Manager Male Gurgaon Location-shristi","Hiring Hr Executive/ Hr Manager Male Gurgaon Location-shristi","Sharda Consultancy Services","Delhi NCR- Gurgaon","bpo hiring- hr recruiter- hr tech support- HR Executive...","2018-03-21",1.0,4.0,0.0,0.0
"Assistant Manager - HR","Assistant Manager - HR","Columbia Asia Hospitals Private Limited","Bengaluru","Recruitment- Performance Management- Employee Engagement","2018-03-20",3.0,6.0,0.0,0.0
"HR & Admin Female  - AGE NO BAR","HR & Admin Female  - AGE NO BAR","SRI RAJARAJESHWARI AND CO.","Bengaluru","Hr Administration- Recruitment- Statutory Compliance- It- Ites...","2018-03-21",2.0,6.0,0.0,0.0
"HR & Administration Executive","HR & Administration Executive","Delta Tech Engineers","Delhi NCR- Gurgaon- Noida","hr administration- interviewing- recruitment- staffing- hr executive...","2018-03-21",0.0,1.0,175000.0,400000.0
"HR Executive - Generalist","HR Executive - Generalist","Flair Placements","Navi Mumbai","HR- Exit Formalities- Recruitment- Payroll- HRM- Office Skills- MS Office","2018-03-21",1.0,5.0,0.0,0.0
"Assistant Manager HR","Assistant Manager HR","Neetu Ohri","Mumbai","HR Generalist Activities- HR Assistance- Talent Acquisition- Human Resource...","2018-03-21",3.0,5.0,125000.0,400000.0
"HR Executive Generalist/ Recruitment","HR Executive Generalist/ Recruitment","PRFC","Faridabad","HR Operations- Recruitment- Communication Skills- Human Resource Management...","2018-03-21",1.0,2.0,275000.0,300000.0
"HR Recruiter In Indore","HR Recruiter In Indore","Vishal Consultants","Indore","Recruitment- HR- HR Recruiter- hr executive- recruitment executive","2018-03-21",0.0,1.0,80000.0,125000.0
"HR Executive/ HR Recruiter/ HR Officer - Freshers","HR Executive/ HR Recruiter/ HR Officer - Freshers","Empedia Consulting Group","Vadodara- Trivandrum- Thrissur- Surat- Ranchi- Nellore","HR- Recruitment- Payroll- Office Management- Mba Hr Fresher- Mba Fresher...","2018-03-21",0.0,4.0,0.0,0.0
"HR Recruiter (males Only)","HR Recruiter (males Only)","Backer Associates","Mumbai(Chembur)","recruitment- hr- sourcing- screening- followup with the candidates...","2018-03-21",3.0,5.0,0.0,0.0
"HR Recruiter / HR Executive / HR Generalist","HR Recruiter / HR Executive / HR Generalist","D Square Technologies","Bengaluru- Pune- Chennai- Coimbatore- Kochi- Vellore","HR Generalist Activities- Recruitment- Administration- Record Keeping...","2018-03-21",0.0,3.0,0.0,0.0
"Urgently Require HR Executive (human Resources) - Male Candidates","Urgently Require HR Executive (human Resources) - Male Candidates","PRISM MANPOWER SERVICES","Mumbai","HR Policies- Salary- Letter Drafting- Statutory Compliance- payroll...","2018-03-21",3.0,8.0,200000.0,350000.0
"AGM- Hr-administration-manufacturing- Mnc-alwar-rajasthan","AGM- Hr-administration-manufacturing- Mnc-alwar-rajasthan","Vesat Management Consultants Pvt. Ltd","Alwar","Recruitment- General Administration- ER- IR- Grievance Handling...","2018-03-21",10.0,15.0,2500000.0,4000000.0
"Required Junior HR for Raipur Chhattisgarh","Required Junior HR for Raipur Chhattisgarh","Milestone Jobs","Raipur- Bhilai/Bhillai","HR Policies- Recruitment- PF- ESIC- Problem Solving- Communication Skills...","2018-03-21",1.0,3.0,125000.0,175000.0
"HR Executive","HR Executive","OMGI Associates","Aurangabad","Recruitment- HR- P&A;- Payroll","2018-03-21",3.0,8.0,300000.0,450000.0
"HR (maruti Automobile)","HR (maruti Automobile)","Shaleen management consultants private limited","Indore","HR- Payroll Software- Recruitment- ESIC- Attendance Management- PF- Savior","2018-03-21",1.0,2.0,0.0,0.0
"Required HR Recruiter/ Sr.hr Recruiter For Niyukti Consultants","Required HR Recruiter/ Sr.hr Recruiter For Niyukti Consultants","Niyukti Management Consultants","Delhi(Shakarpur)","recruitment- hr- hr recruiter- recruitment executive- hr executive...","2018-03-21",1.0,6.0,100000.0,250000.0
"HR Manager and Team Leader for Niyukti Consultants For BFSI","HR Manager and Team Leader for Niyukti Consultants For BFSI","Niyukti Management Consultants","Delhi(Nirman Vihar)","recruitment- hr recruiter- recruitment executive- hr executive- team leader...","2018-03-21",3.0,8.0,125000.0,375000.0
"HR Manager and Team Leader for Niyukti Consultants","HR Manager and Team Leader for Niyukti Consultants","Niyukti Management Consultants","Delhi(Nirman Vihar)","recruitment- hr recruiter- recruitment executive- hr executive- team leader...","2018-03-21",3.0,8.0,175000.0,400000.0
"Walk-in Interview For HR Assistants / Recruiters 1-2 yrs Chennai","Walk-in Interview For HR Assistants / Recruiters 1-2 yrs Chennai","VICTORY HUMAN RESOURCES CONSULTANTS","Chennai","hr- recruitment- staffing- recruiter- hr executive- hr assistant- female hr...","2018-03-21",0.0,1.0,0.0,0.0
"HR Assistant","HR Assistant","Shaleen management consultants private limited","Udaipur","HR Assistance- human resource assistance...","2018-03-21",0.0,1.0,0.0,0.0
"Urgent Hiring For HR Recruiter- Fresher","Urgent Hiring For HR Recruiter- Fresher","MARS Placements Services","Delhi","Recruitment- Hiring- HR- Placement- Written Communication...","2018-03-21",0.0,0.0,0.0,0.0
"HR Executive","HR Executive","NETPROS LLC","Chennai(Annai Nagar)","HR Executive- recruiter- it recruiter- non it recruiter...","2018-03-21",1.0,3.0,125000.0,200000.0
"HR Executive","HR Executive","Jash Precision Tools Ltd.","Indore","HR- Employee Engagement- Recruitment- PMS- KRA- Training","2018-03-20",4.0,6.0,0.0,0.0
"Recruitment Delivery Head - RPO/ HR Outsourcing Firm","Recruitment Delivery Head - RPO/ HR Outsourcing Firm","Perfect Placer Management Consulting","Bengaluru- Delhi NCR","Recruitment- Hr Outsourcing- Operations Management- Training...","2018-03-20",12.0,20.0,0.0,0.0
"Urgently Require HR Assistant","Urgently Require HR Assistant","HITEK ENGINEERING SERVICES","Mumbai","HR Assistance- Recruitment- Attendance Management- Payroll...","2018-03-20",1.0,2.0,100000.0,150000.0
"HR Executive Talent Acquisition","HR Executive Talent Acquisition","Richi Circuitronix Pvt. Ltd","Gurgaon(Udyog Vihar)","recruitment- head hunting- shortlisting- interview scheduling- sourcing...","2018-03-20",1.0,3.0,100000.0,225000.0
"Assistant Manager HR","Assistant Manager HR","Peregrine Guarding Private Limited","Gurgaon","joining formalities- exit formalities- payroll- hr operations...","2018-03-20",2.0,5.0,225000.0,350000.0
"HR Manager","HR Manager","Move One FZE","Pune","HR Strategy- Recruitment- Employee Engagement- HR Generalist Activities- HR...","2018-03-20",5.0,10.0,0.0,0.0
"HR Recruiter - Female","HR Recruiter - Female","Comodo Security Solutions Private Limited","Chennai","recruitment- hr- sourcing profiles- interview coordination- interviewing...","2018-03-20",1.0,2.0,0.0,0.0
"HR Executive","HR Executive","Ramada Plaza Chennai","Chennai- Hyderabad- Bengaluru","Recruitment- HR- Welfare- Payroll- Human Resource Management- Personnel","2018-03-20",4.0,7.0,0.0,0.0
"Urgent Requirement for HR Trainee - Female","Urgent Requirement for HR Trainee - Female","Datapage Digital Services Private Limited","Coimbatore","hr generalist activities- recruitment- joining formalities...","2018-03-20",0.0,1.0,0.0,0.0
"Senior Executive / Assistant Manager HR & Admin","Senior Executive / Assistant Manager HR & Admin","Cybercity Builders & Developers Pvt. Ltd.","Hyderabad","Statutory Compliances- Labour Laws- Payroll- Recruitment and Staffing...","2018-03-20",4.0,7.0,350000.0,500000.0
"HR Executive/manager","HR Executive/manager","Samanvay Saptarshi","Vadodara","Recruitment- HR Planning- Employee Engagement- Selection...","2018-03-20",2.0,5.0,175000.0,200000.0
"Associate HR Recruiter","Associate HR Recruiter","PROVANA INDIA PRIVATE LIMITED","Noida(Sector-2 Noida)","Recruitment- Screening- Job Posting- Telephonic- Sourcing- Interviewing- HR...","2018-03-20",1.0,2.0,200000.0,300000.0
"HR Officer/ Executive","HR Officer/ Executive","Bio-gen Extracts Pvt. Ltd","Bengaluru","Employee Relations- HR- human resource- hr executive- hr recruiter","2018-03-20",0.0,4.0,0.0,0.0
"HR Trainee","HR Trainee","Global Advertisement Services Private Limited society","Pune","Recruitment- Job Posting- Sourcing Profiles- HR- Induction- Onboarding...","2018-03-20",0.0,0.0,0.0,0.0
"HR Generalist/0+ Years/chennai","HR Generalist/0+ Years/chennai","Fipsar Technologies Private Limited","Chennai","HR Generalist Activities- Recruitment- Employee Engagement...","2018-03-20",0.0,3.0,0.0,0.0
"HR Executive / HR Payroll Walkin","HR Executive / HR Payroll Walkin","I Way Solutions","Delhi- Chandigarh- Mohali","hr- communication skills- hiring- payroll- fresher- java- .net- btech- it...","2018-03-22",0.0,5.0,100000.0,250000.0
"Urgent Requirement for HR Recruiter at North Delhi Location.","Urgent Requirement for HR Recruiter at North Delhi Location.","Mensen Corporate Solutions","Delhi","Recruitment- Screening- Head Hunting- Sourcing- HR- Linkedin- calling...","2018-03-22",0.0,3.0,100000.0,175000.0
"HR Business Partner - BFSI","HR Business Partner - BFSI","Premium","Kolkata","Strategic HR- Recruitment- Employee Engagement- Business HR...","2018-03-20",2.0,6.0,0.0,0.0
"HR Business Partner - Lead","HR Business Partner - Lead","Wipro GSH (A Division of Wipro Limited)","Pune","Recruitment- Performance management- Employee engagement- Talent management...","2018-03-21",4.0,6.0,0.0,0.0
"HR Business Partner - Lead","HR Business Partner - Lead","Wipro GSH (A Division of Wipro Limited)","Bengaluru","Recruitment- Performance management- Employee engagement- Talent management...","2018-03-21",4.0,6.0,0.0,0.0
"HR Business Partner - Lead","HR Business Partner - Lead","Wipro GSH (A Division of Wipro Limited)","Bengaluru","Recruitment- Performance management- Employee engagement- Talent management...","2018-03-21",4.0,7.0,0.0,0.0
"HR Executive (female) with an MNC @ Nashik","HR Executive (female) with an MNC @ Nashik","Venkatesh Placements  Management Services","Nasik","HR- PMS- SALARY- TRAINING- RECRUITMENT- talent acquisition","2018-03-20",3.0,6.0,300000.0,500000.0
"HR Business Partner - Lead","HR Business Partner - Lead","Wipro GSH (A Division of Wipro Limited)","Chennai","Recruitment- Performance management- Employee engagement- Talent management...","2018-03-21",4.0,6.0,0.0,0.0
"Genpact Hiring for Finance Based Process|21th Feb||ref:hr Khushboo","Genpact Hiring for Finance Based Process|21th Feb||ref:hr Khushboo","GENPACT India Private Limited","Hyderabad","General Accounting- Accounts Receivable- Accounts Payable- Finance- RTR...","2018-03-20",0.0,5.0,100000.0,400000.0
"HR Technology Specialist","HR Technology Specialist","ZS Associates {India} Pvt Ltd","Pune","succcessfactors- SF- hris- HR technology- SAP- HR Information System- human...","2018-03-21",8.0,10.0,0.0,0.0
"Sr. HR & Admin","Sr. HR & Admin","SUCCESSWRKS HR Solutions Private Limited","Mumbai","HR Administration- IR- Personnel Management- Training- Vehicle Management...","2018-03-20",5.0,9.0,0.0,0.0
"Urgently Looking for SAP ABAP HR Consultants--hyderabad Location","Urgently Looking for SAP ABAP HR Consultants--hyderabad Location","NGA HR India Pvt Ltd","Hyderabad","abap - hr- webdynpro- sap abap- data migration- user exits- bapi...","2018-03-20",4.0,9.0,0.0,0.0
"Head HR","Head HR","Bright Future Consultancy","Delhi NCR","HR- IR","2018-03-21",10.0,15.0,0.0,0.0
"HR Manager for Food Company","HR Manager for Food Company","Shaleen management consultants private limited","Ujjain","hr- Maintain 400 500 Employees","2018-03-21",7.0,9.0,0.0,0.0
"HR Executive","HR Executive","Shaleen management consultants private limited","Indore","HR Executive","2018-03-21",2.0,7.0,0.0,0.0
"HR Manager","HR Manager","IHA CONSULTING Services Pvt. Ltd.","Hyderabad","hr- Manager- HR Administration","2018-03-21",5.0,10.0,200000.0,275000.0
"HR Executive / Male / Jaipur Location","HR Executive / Male / Jaipur Location","Shaleen management consultants private limited","Jaipur","hr- communication skills- human resources","2018-03-21",0.0,1.0,0.0,0.0
"HR Executive/senior HR Executive","HR Executive/senior HR Executive","MARS Placements Services","Nasik","Senior HR- Training- Payroll","2018-03-21",3.0,5.0,0.0,0.0
"HR Executive MALE","HR Executive MALE","Shaleen management consultants private limited","Indore","HR Executive- ess administration- HR- business administration","2018-03-21",3.0,4.0,0.0,0.0
"HR Executive","HR Executive","Shaleen management consultants private limited","Jaipur","Benefits- HR- Compensation- Training- Orientation- Labor Relations...","2018-03-21",2.0,7.0,0.0,0.0
"HR Manager ( Maintaining KPI KRA and JDs)","HR Manager ( Maintaining KPI KRA and JDs)","Shaleen management consultants private limited","Indore","HR Manager- HR- HR Operations- performance management- Admin","2018-03-21",3.0,4.0,0.0,0.0
"Required HR Manager for Restaurant Industry","Required HR Manager for Restaurant Industry","Samvaad consultancy services","Mumbai- Pune","HR- Induction- Joining Formalities- Grievance Handling- Orientation...","2018-03-21",3.0,5.0,300000.0,500000.0
"HR Assistant ( Male )","HR Assistant ( Male )","Aranis Business Process Services Private Limited","Bengaluru","HR Assistance- Communication Skills- Computer Skills","2018-03-21",0.0,1.0,200000.0,250000.0
"Senior HR Executive (Hr Shared Services) (cochin Location)","Senior HR Executive (Hr Shared Services) (cochin Location)","Dhruvan Services","Kochi","senior hr- hr operations- hrms- hr shared services- uae- hrms systems...","2018-03-21",3.0,8.0,200000.0,400000.0
"HR Manager with a TOP Networking Company","HR Manager with a TOP Networking Company","SUN CONSULTANTS","Bengaluru(Marathahalli)","hr- human resource management- hr generalist management...","2018-03-21",3.0,6.0,325000.0,700000.0
"Hiring for Client Acquisition Head for Leading HR Consulting Firm.","Hiring for Client Acquisition Head for Leading HR Consulting Firm.","PMS Consulting","Delhi NCR(Connaught Place)","Lead Generation- Cold Calling- HR Consulting- Hiring- Client Acquisition...","2018-03-21",1.0,4.0,200000.0,450000.0
"HR Consultant Practice Lead","HR Consultant Practice Lead","Oasis Resource Management Pvt. Ltd.","Delhi NCR(Nehru Place)","Female Client Servicing- Client Relationship Management...","2018-03-21",3.0,8.0,200000.0,700000.0
"HR Executive","HR Executive","Big Sky Manpower Solution","Indore","HR- Salary","2018-03-21",2.0,3.0,125000.0,175000.0
"Urgent Requirement for HR Executive (female)_daryaganj","Urgent Requirement for HR Executive (female)_daryaganj","Cake N Slice","Delhi(DaryaGanj)","HR- hr executive- hr assistant","2018-03-21",1.0,6.0,50000.0,250000.0
"Male HR Payroll || An Automobile 6 Days Working","Male HR Payroll || An Automobile 6 Days Working","Future Height Recruiters","Gurgaon","PF- ESIC- HR- Payroll- Leave- Welfare- Attendance- Finance...","2018-03-21",2.0,7.0,450000.0,500000.0
"HR Manager","HR Manager","Freelancer Neha Kashyap","Noida","good comminiaction skils- ESI- pf- payroll- Compliance","2018-03-21",2.0,3.0,300000.0,350000.0
"Plant HR Head - Tamilnadu","Plant HR Head - Tamilnadu","Selective Consultants Pvt. Ltd.","Chennai","ir- hrd- head hr & ir- senior manager hr & ir- industrial relations...","2018-03-21",16.0,25.0,0.0,0.0
"Deputy Mgr HR - Indian Business Conglomerate - Chittorgarh","Deputy Mgr HR - Indian Business Conglomerate - Chittorgarh","LNS Management Consulting Private Limited","Chittorgarh","Deputy Mgr HR - Indian Business Conglomerate - Chittorgarh","2018-03-21",3.0,8.0,0.0,0.0
"Senior Manager HR & IR - Plant HR","Senior Manager HR & IR - Plant HR","Human Resources and Management Consultants","NCR- Bawal","MSW- Plant HR- Factory HR- Plant HR Head- MLW- irpm- LLB","2018-03-21",15.0,20.0,1400000.0,1800000.0
"HR cum Admin Executive (fresher) for Reputed Company","HR cum Admin Executive (fresher) for Reputed Company","Helium Recruitments","Chandigarh- Mohali","hr administration- admin executive- communication skills- HR Executive...","2018-03-21",0.0,1.0,90000.0,150000.0
"Medical Coding Job For Freshers / Experienced in Chennai- Ct HR Madhu","Medical Coding Job For Freshers / Experienced in Chennai- Ct HR Madhu","ISkills Solutions","Chennai- Nellore- Thanjavur","medical coding- medical coder- nursing- gnm- staff nurse- botany- zoology...","2018-03-21",0.0,0.0,250000.0,300000.0
"Urgent Vacancy For Hr.executive","Urgent Vacancy For Hr.executive","Middle Range Services Private Limited","Bhubaneshwar","HR Processes- Benefits- Hiring- Interviewing- good communication skill...","2018-03-21",0.0,0.0,225000.0,300000.0
"HR Executive","HR Executive","MARS Placements Services","Nasik","HR- Joining Formalities- Attendance Management- Payroll...","2018-03-21",3.0,5.0,0.0,0.0
"Junior Officer-- Admin and HR","Junior Officer-- Admin and HR","Job Hunt Services","Hyderabad- Ratnagiri- Thane","hr administration- transportation- vendor management- security services...","2018-03-21",0.0,2.0,100000.0,375000.0
"Sr HR Recuiter (2-6 yrs)","Sr HR Recuiter (2-6 yrs)","CareerWave HR Solutions","Bengaluru(Cunningham Road)","Recruitment- HR Recruiter- Recruitment Consultant...","2018-03-20",1.0,6.0,0.0,0.0
"Hr Recruiter for a Leading Recruitment Co - Guindy","Hr Recruiter for a Leading Recruitment Co - Guindy","BLUE CHIP HR SOLUTIONS PVT LTD","Chennai","hr recruiter- hr executive- recruitment executive- recruitment manager...","2018-03-20",0.0,2.0,125000.0,175000.0
"Executive - Human Resources","Executive - Human Resources","Visual Graphics Computing Services India Pvt.Ltd","Bengaluru","HR Policies- Benefits- Exit Interviews- Onboarding- HR Processes...","2018-03-20",4.0,6.0,0.0,0.0
"Senior Executive -  HR","Senior Executive -  HR","Wipro GSH (A Division of Wipro Limited)","Mumbai","Performance management- Talent management- Policies- attrition...","2018-03-20",2.0,5.0,0.0,0.0
"Officer - HR / Admin - Jharsuguda","Officer - HR / Admin - Jharsuguda","Apar Industries Ltd","Jharsuguda","HR Administration- Wage Administration- Salary- Contract Labour Management-...","2018-03-20",1.0,3.0,100000.0,300000.0
"Account & HR Assistant","Account & HR Assistant","Sahib Equipments Pvt. Ltd.","Navi Mumbai","PF- ESIC- Office Administration- Salary- Attendance- Data Entry- data entry...","2018-03-20",5.0,10.0,150000.0,200000.0
"HR & Admin Executive at Delhi Head Office of Reputed IT Company","HR & Admin Executive at Delhi Head Office of Reputed IT Company","Eagle Information System Pvt. Ltd.","Delhi NCR","hr administration- office executive- hr executive- vendor management...","2018-03-20",2.0,6.0,250000.0,425000.0
"HR Executive and Assistant Manager","HR Executive and Assistant Manager","Ayushman Hospital and Health Services","Delhi","HR- Exit Formalities- General Administration- Welfare- Attendance...","2018-03-20",3.0,6.0,0.0,0.0
"HR Generalist in US MNC","HR Generalist in US MNC","Sun Knowledge Pvt. Ltd","Kolkata","hr generalist activities- hr generalist- hr executive- leave management...","2018-03-20",3.0,8.0,0.0,0.0
"HR Executive","HR Executive","Cinepolis India Private Limited","Mumbai","HR- Joining Formalities- Exit Formalities- Payroll Management...","2018-03-20",1.0,3.0,100000.0,200000.0
"Urgent/immediate Requirement for HR Executive - Electronic city","Urgent/immediate Requirement for HR Executive - Electronic city","InKnowTech Private Limited","Bengaluru(Electronics City Phase 1)","HR Generalist Activities- Payroll- ESI- pf- statutory compliance...","2018-03-20",2.0,6.0,250000.0,375000.0
"Senior HR Executive-hr Compliance and Generalist role","Senior HR Executive-hr Compliance and Generalist role","GlobalStep Services Pvt Ltd","Pune","Senior HR- HR Operations- Employee Engagement- Exit Formalities...","2018-03-20",3.0,6.0,50000.0,300000.0
"HR Manager","HR Manager","Alcobrew Distilleries India Pvt. Ltd.","Gurgaon","HR Administration- Training Needs- Employee Engagement- Learning- Corporate...","2018-03-20",3.0,5.0,600000.0,900000.0
"Excellent Opportunity In Borivali for HR Jr. Recruiter/recruiter","Excellent Opportunity In Borivali for HR Jr. Recruiter/recruiter","WB Sales Scout","Mumbai- Mumbai Suburbs","recruitment- sourcing- bulk hiring- mass recruitment- sales- hr...","2018-03-21",0.0,3.0,150000.0,350000.0
"Human Resource Operations!! Leading BPO in Noida!! Day Shifts","Human Resource Operations!! Leading BPO in Noida!! Day Shifts","Axis Placement Consulting","Delhi NCR- Greater Noida- Noida","HR Operations- Blended Process- HRO- Voice Process- HRO Voice- EXL- CCE...","2018-03-21",2.0,7.0,225000.0,400000.0
"Medical Coding Job for All Life Science Grads Freshers - Ct HR Madhu","Medical Coding Job for All Life Science Grads Freshers - Ct HR Madhu","ISkills Solutions","Chennai- Coimbatore- Erode","medical coding- medical coder- bds- bpt- nursing- gnm- staff nurse- botany-...","2018-03-21",0.0,0.0,250000.0,300000.0
"HR Executive","HR Executive","Selectsys India Pvt Ltd","Hyderabad","HR- Attendance- Employee Grievances- Time Management","2018-03-20",1.0,2.0,150000.0,300000.0
"Don't Miss the Opportunity to be a part of Wipro(pune)!!hr Arpita","Don't Miss the Opportunity to be a part of Wipro(pune)!!hr Arpita","Wipro BPS (A division of Wipro Limited)","Kolkata","Customer Service- customer care- CSA- CSE- BPO- call center- voice- inbound","2018-03-20",1.0,3.0,50000.0,200000.0
"HR Generalist- Looking for Immediate Joiners","HR Generalist- Looking for Immediate Joiners","Contacare Ophthalmic Pvt Ltd","Mumbai(Shanti Nagar Borivali)","HR Generalist Activities- Induction Training- Employee Engagement...","2018-03-20",2.0,6.0,0.0,0.0
"HR Executive (rotational Night Shift)","HR Executive (rotational Night Shift)","Sequential Technology International (India) Pvt Ltd","Bengaluru","HR Functions- HRIS- Attendance Management- Grievance Handling- Leave...","2018-03-22",1.0,4.0,0.0,0.0
"Senior Human Resources Representative/hr Business Partner","Senior Human Resources Representative/hr Business Partner","Rockwell Collins (India) Enterprises Pvt Ltd","Bengaluru","hr- employee relations- business partnering- human resourses...","2018-03-20",7.0,11.0,0.0,0.0
