"desig","details","org","loc","keyskills","date","expLow","expHigh","salLow","salHigh "
"Urgent Opening for HR Recruiter (full Time/ Part Time)","Urgent Opening for HR Recruiter (full Time/ Part Time)","PIONEER CALLNET TRAINING and PLACEMENT","Mumbai- Navi Mumbai- Thane","recruitment- hiring- hr- part time- Recruitment Executive- hr recruiter...","2018-03-21",0.0,5.0,0.0,0.0
"Assistant Manager - Human Resources - Law Firm","Assistant Manager - Human Resources - Law Firm","Premium","Mumbai","HR Policies- Hrbp- Employee Engagement- Talent Management...","2018-03-21",3.0,5.0,0.0,0.0
"HR Recruiter Trainee","HR Recruiter Trainee","XecuteHR Solutions Private Limited","Gurgaon(Sohna Road)","Recruitment- Screening- Head Hunting- Mass Mailing- Sourcing- HR- Linkedin-...","2018-03-21",0.0,1.0,0.0,0.0
"HR Recruiter","HR Recruiter","BSS BUSINESS CONSULTANCY PRIVATE LIMITED","Bengaluru","HR- Recruitment- Secretarial Activities- Monthly Reports...","2018-03-21",0.0,2.0,0.0,0.0
"HR Recruiter","HR Recruiter","Provizor IT Services Pvt Ltd","Bengaluru","Recruitment- Screening- Sourcing Profiles- HR- Salary- Incentives...","2018-03-21",0.0,1.0,125000.0,150000.0
"Hiring for HR Recruiter","Hiring for HR Recruiter","Provizor IT Services Pvt Ltd","Bengaluru","Recruitment- Hiring- HR- Sourcing- Salary","2018-03-21",0.0,1.0,175000.0,275000.0
"Manager HR","Manager HR","Veda Corporate Services","Gurgaon","strategic hr- employee engagement- talent acquisition...","2018-03-21",2.0,5.0,1500000.0,1600000.0
"Manager Corporate HR","Manager Corporate HR","Veda Corporate Services","Gurgaon","Strategic HR- Employee Engagement- Talent Acquisition- Corporate HR...","2018-03-21",2.0,4.0,1000000.0,1300000.0
"Urgent Opening - HR Executive _In Vaishali Sec-4 UP (ghaziabad).","Urgent Opening - HR Executive _In Vaishali Sec-4 UP (ghaziabad).","Acent High Soft Technologies Pvt. Ltd.","Ghaziabad(Vaishali)- Delhi NCR","Recruitment- Screening- Interview Scheduling- Sourcing- Referencing- HR...","2018-03-21",2.0,7.0,0.0,0.0
"Urgent Openings for HR Recruiter_bangalore","Urgent Openings for HR Recruiter_bangalore","BSS BUSINESS CONSULTANCY PRIVATE LIMITED","Bengaluru(5th block Koramangala)","HR Recruiter- recruitment executive- recruiter- staffing- it recruiter- non...","2018-03-21",0.0,2.0,50000.0,200000.0
"Urgent Opening For HR Manager For Jordan","Urgent Opening For HR Manager For Jordan","J.R.CONSULTANTS","Chennai","HR Manager- hr head- human resource head- recruitment head...","2018-03-21",15.0,20.0,400000.0,900000.0
"Walk-in For HR Recruiter(male) - Chennai","Walk-in For HR Recruiter(male) - Chennai","Harita Techserv Limited","Chennai","Recruitment- HR- naukri- recruiter- Sourcing- Screening","2018-03-21",1.0,2.0,0.0,0.0
"Opportunity for HR Recruitment/senior HR Recruitment at Convate","Opportunity for HR Recruitment/senior HR Recruitment at Convate","Convate Consultancy Services Pvt Ltd","Bengaluru(Old Airport Road)","it recruitment- senior hr- shortlisting- sourcing- screening...","2018-03-21",0.0,2.0,0.0,0.0
"Assistant Manager - Human Resources","Assistant Manager - Human Resources","Premium","Mumbai","HR Policies- Hrbp- Employee Engagement- Talent Management...","2018-03-21",3.0,6.0,0.0,0.0
"Trainee  HR Recruitment","Trainee  HR Recruitment","Veda Corporate Services","Ghaziabad","recruitment","2018-03-21",0.0,1.0,125000.0,150000.0
"HR Recruiter_ Female only","HR Recruiter_ Female only","BSS BUSINESS CONSULTANCY PRIVATE LIMITED","Bengaluru","hr- recruitment- monthly reports- communication skills","2018-03-21",0.0,2.0,100000.0,225000.0
"HR Recruiter - IT CTH ( Infrastructure Domain ) - Domestic Recruitment","HR Recruiter - IT CTH ( Infrastructure Domain ) - Domestic Recruitment","2Coms Consulting Pvt Ltd.","Bengaluru","recruitment- screening- sourcing- hiring- hr- bench- contract- talent- TAG","2018-03-21",1.0,3.0,0.0,0.0
"HR Executive - Corporate HR","HR Executive - Corporate HR","MModal Global Services Private Limited","Navi Mumbai","corporate hr- hr executive- hrms- background verification- biometrics...","2018-03-22",1.0,4.0,0.0,0.0
"Senior HR Recruiter - IT & NON IT @ HR Remedy - Pune","Senior HR Recruiter - IT & NON IT @ HR Remedy - Pune","HR Remedy India","Pune","hr- recruitment- hiring- bulk hiring- volume hiring- volume recruitment...","2018-03-21",1.0,4.0,175000.0,300000.0
"Senior Manager/general Manager/vice President - HR Services Business","Senior Manager/general Manager/vice President - HR Services Business","CIEL HR Services Pvt Ltd","Panjim- Gurgaon- Hubli- Mysore- Nagpur- Jaipur- Jodhpur- Kota- Kanpur","hr- general management- heading profit centre- senior management...","2018-03-21",10.0,20.0,0.0,0.0
"Urgent Hiring For Sr. Talent Acquisition/ Operation Executive- HR","Urgent Hiring For Sr. Talent Acquisition/ Operation Executive- HR","Voice HR Solutions","Gurgaon","hr- talent acquisition- HR Operations- hr generalist...","2018-03-21",1.0,5.0,100000.0,400000.0
"HR Executive(school Management)","HR Executive(school Management)","CIEL HR Services Pvt Ltd","Hyderabad","Hr Mba- Recruitment- PF- Employee Grievances- Grievance Handling- Salary...","2018-03-21",3.0,5.0,50000.0,200000.0
"HR Executive (male) For Gietbaniatangibhubaneswar","HR Executive (male) For Gietbaniatangibhubaneswar","Logic Manpower Services","Bhubaneshwar","HR Policies- Recruitment- Exit Interviews- Employee Orientation...","2018-03-21",1.0,2.0,125000.0,175000.0
"Urgent Job Vacancy for HR Officer in Udaipur(dariba/zawar) in Rajastha","Urgent Job Vacancy for HR Officer in Udaipur(dariba/zawar) in Rajastha","Adecco India Private Limited","Udaipur","hr mba- recruitment- pf- gratuity- payroll- contract labour...","2018-03-22",1.0,6.0,100000.0,350000.0
"Walkin Interview for HR Generalist at ACT Rajajinagar Office","Walkin Interview for HR Generalist at ACT Rajajinagar Office","Atria Convergence Technologies Pvt Ltd","Bengaluru","hr generalist activities- recruitment- business hr- strategic hr...","2018-03-21",1.0,5.0,150000.0,300000.0
"Hiring Senior HR Recruiter","Hiring Senior HR Recruiter","Demandshore Solutions Private Limited","Pune","Recruitment- Screening- Sourcing- Hiring- HR- Linkedin","2018-03-21",2.0,4.0,350000.0,425000.0
"Executive - HR & Admin","Executive - HR & Admin","Naprod Life Sciences Private Limited","Tarapur","HR Administration- Recruitment- Exit Formalities- Joining Formalities...","2018-03-21",5.0,7.0,0.0,0.0
"HR Manager","HR Manager","Futomic Consultancies Pvt. Ltd","Noida- Ghaziabad(Vaishali)","HR- Human Resourse- Manager- HR Manager- hr executive- Recruiter...","2018-03-21",2.0,4.0,200000.0,300000.0
"Walk-in for HR Operation Executive@ Paytm","Walk-in for HR Operation Executive@ Paytm","One97 Communications Limited","Delhi NCR","Recruitment- HR Operations- Hiring- Compensation- Benefits- Staffing...","2018-03-21",1.0,4.0,0.0,0.0
"HR Generalist","HR Generalist","ACME Interiors Pvt Ltd","Bengaluru","HR Generalist Activities- Recruitment- Employee Engagement...","2018-03-21",5.0,7.0,350000.0,400000.0
"Immediate Joiner for HR Manager ( Female ) for Kempfort Bengalore","Immediate Joiner for HR Manager ( Female ) for Kempfort Bengalore","Kempfort Mall","Bengaluru","HR- Recruitment- Talent Management- Performance Management- Training- Human...","2018-03-21",7.0,12.0,700000.0,1700000.0
"Work and Settle in Canada for HR Manager                        V2AK","Work and Settle in Canada for HR Manager                        V2AK","Apex Visas","Canada","Selection- HR- Recruitment- Policies- Human Resource Management- hrm","2018-03-21",10.0,15.0,1800000.0,3300000.0
"HR Recruiter","HR Recruiter","Campbell Agro Mfg. Industries Pvt. Ltd.","Mumbai","Recruitment- Shortlisting- Screening- Sourcing- HR- Negotiation","2018-03-21",1.0,3.0,175000.0,275000.0
"HR Executive - Kandivali","HR Executive - Kandivali","Ravi Group","Mumbai","hr- hiring- human resource management- hr generalist- hr executive...","2018-03-21",2.0,4.0,175000.0,300000.0
"Executive Human Resources (HR) for Pharma R&D;","Executive Human Resources (HR) for Pharma R&D;","Ribosome Research Centre Pvt. Ltd.","Surat","selection process- recruitment- SOP- Training Coordination- Payroll...","2018-03-21",4.0,9.0,250000.0,600000.0
"HR Executive (horamavu main Road)","HR Executive (horamavu main Road)","ACME Interiors Pvt Ltd","Bengaluru","hr- recruitment- non it- non it recruiter","2018-03-21",4.0,5.0,350000.0,450000.0
"HR Manager - Leading Housing Finance Company - Udaipur (INR 10-15 LPA)","HR Manager - Leading Housing Finance Company - Udaipur (INR 10-15 LPA)","DSB Resources (LLP)","Udaipur","Recruitment- Selection Process- HR- Human Resource Management- Policies...","2018-03-21",5.0,8.0,1000000.0,1500000.0
"Executive HR- Recruitment (noida)","Executive HR- Recruitment (noida)","A Multinational Company in Exhibition and Event management.","Noida","Recruitment- Sourcing- HR- Human Resource- Recruiter- HR Executive","2018-03-21",1.0,2.0,0.0,0.0
"Recruitment Executive/employee Relation Executive/karvy HR BPO","Recruitment Executive/employee Relation Executive/karvy HR BPO","Karvy Digikonnect limited Limited","Noida(Sector-64 Noida)","Recruitment- HR BPO- Screening- Sourcing- Interviewing- Grievance Handling-...","2018-03-21",0.0,4.0,100000.0,225000.0
"HR Executive","HR Executive","Aarogyam Medical College & Hospital (AROGYAMEDUCATIONAL TRUST)","Roorkee- Haridwar","HR- Salary- Recruitment- human resource- Payroll","2018-03-21",1.0,6.0,0.0,0.0
"Walk In For Hr/hr Recruiter/chinchwad","Walk In For Hr/hr Recruiter/chinchwad","Cadmaxx Solutions Pvt Ltd","Pune(Chinchwad)","Recruitment- Screening- Sourcing- HR- human resource- hr executive","2018-03-21",0.0,1.0,100000.0,200000.0
"Urgent Hiring for HR Recruiter","Urgent Hiring for HR Recruiter","Autokraft Infotech","Kochi- Trivandrum- Hyderabad","Hiring- Recruitment- Hr Solutions- Payroll- Compliance Management...","2018-03-21",0.0,5.0,0.0,0.0
"Hiring for HR Assistant @ K. R. Mangalam World School (head Office)","Hiring for HR Assistant @ K. R. Mangalam World School (head Office)","K.R.Mangalam World School","Delhi(Mehrauli+1)","Recruitment- HR Assistance- Hiring- staffing- documentation- Filing...","2018-03-21",0.0,1.0,90000.0,175000.0
"Job Opening For HR Executive For Rawat Brothers Furniture Pvt Ltd","Job Opening For HR Executive For Rawat Brothers Furniture Pvt Ltd","Rawat Brothers Furnitures Pvt Ltd","Pune","HR Audit- Selection- Recruitment- Training- Manpower Planning","2018-03-21",0.0,3.0,0.0,0.0
"Senior HR Executive HR Manager","Senior HR Executive HR Manager","Autokraft Infotech","Kochi- Kota- Trivandrum","Senior HR- Recruitment- Grievance Handling- Compensation...","2018-03-21",0.0,4.0,0.0,0.0
"Senior HR Executive","Senior HR Executive","Autokraft Infotech","Pune- Bengaluru","Senior HR- Recruitment- Exit Formalities- joining formalities- training and...","2018-03-21",0.0,4.0,0.0,0.0
"Asst Manager- HR ( HR Generalist)- Noida","Asst Manager- HR ( HR Generalist)- Noida","A Multinational Company in Exhibition and Event management.","Noida","Recruitment- HR- Human Resource Management- Employee relations- Payroll...","2018-03-21",5.0,8.0,0.0,0.0
"Team Leader - HR - Recruitment - Day Shift","Team Leader - HR - Recruitment - Day Shift","Imaginators Try Going Beyond","Delhi NCR","TL- Team Leading- Recruitment- HR- hr executive- hr recruiter","2018-03-21",1.0,5.0,250000.0,500000.0
"Head HR","Head HR","Mega Rubber Technologies Pvt. Ltd.","Mumbai","HR- Human Resource Management- Training- organisation development- OD...","2018-03-21",15.0,20.0,1500000.0,2000000.0
"Hiring for Hr-recruiter ITes Hiring Fresher Welcome","Hiring for Hr-recruiter ITes Hiring Fresher Welcome","Genesis HR Services","Pune","ites recruitment- hr- hiring- sourcing- client handling...","2018-03-22",0.0,2.0,70000.0,175000.0
"HR Recruiter IT & NOT IT @ WALK IN !! Aundh / Wakad ","HR Recruiter IT & NOT IT @ WALK IN !! Aundh / Wakad ","Genesis HR Services","Pune","HR- Recruitment- Remedy- Yellow box- IT- HR Recruiter- IT Recruiter...","2018-03-22",0.0,3.0,50000.0,275000.0
"Opening for HR Generalist-gurgaon","Opening for HR Generalist-gurgaon","RANDSTAD INDIA PVT LTD","Gurgaon","HR- Bonus- Gratuity- Payroll- ESIC- EPF- General Administration- Salary...","2018-03-21",1.0,2.0,100000.0,225000.0
"Hiring HR Generalist (offroll) - Delhi - Mahipalpur","Hiring HR Generalist (offroll) - Delhi - Mahipalpur","RANDSTAD INDIA PVT LTD","Delhi NCR","HR Generalist Activities- HR executive- HR cum EA...","2018-03-21",3.0,8.0,0.0,0.0
"Job | Immediate Opening for Peoplesoft/java in HR Domain | Mumbai","Job | Immediate Opening for Peoplesoft/java in HR Domain | Mumbai","RESOURCE ACCESS MANAGEMENT SOLUTIONS PVT LTD","Mumbai","peoplesoft technical- workday- hr- Java","2018-03-21",3.0,4.0,0.0,0.0
"Hiring fro HR Operations -F2F 23rd March","Hiring fro HR Operations -F2F 23rd March","Recruise India Consulting Pvt. Ltd.","Bengaluru","HR Operations","2018-03-21",2.0,5.0,0.0,0.0
"Senior Manager-hr","Senior Manager-hr","Windows Consultants Pvt. Ltd.","Gurgaon","HR- Employee Retention- Exit Interviews- Succession Planning...","2018-03-21",9.0,14.0,0.0,0.0
"Attractive Oppertunities for Freshers and upto 1 yr of exp into HR","Attractive Oppertunities for Freshers and upto 1 yr of exp into HR","Advent Global Solutions Limited","Mumbai","HR- Hiring","2018-03-21",0.0,1.0,50000.0,150000.0
"HR Generalist/ Factory HR","HR Generalist/ Factory HR","BVR People Consulting","Coimbatore","Factory Hr- HR Generalist Activities- contract labour- trade union...","2018-03-21",5.0,10.0,0.0,0.0
"Hiring for HR Generalist Looking for Immediate Joinees  (only Females)","Hiring for HR Generalist Looking for Immediate Joinees  (only Females)","Innova Solutions Private Limited","Chennai- Hyderabad","hr generalist activities- employee engagement- employee retention- employee...","2018-03-21",3.0,5.0,300000.0,500000.0
"HR & Accounts Position","HR & Accounts Position","HUSYS CONSULTING LIMITED","Hyderabad(Jubilee Hills)","HR- Conducting Interviews- Screening- Onboarding- Quick Books- Accounting...","2018-03-21",2.0,7.0,225000.0,400000.0
"National HR Solution Sales Manager - GTM - Consulting Firm","National HR Solution Sales Manager - GTM - Consulting Firm","Premium","Mumbai","Solution Sales- Sales Management- Sales Planning- Client Account Management...","2018-03-21",10.0,15.0,0.0,0.0
"Urgent HR Admin Jr. Officer (male)  for MNC - Gujarat - Vitthalapur","Urgent HR Admin Jr. Officer (male)  for MNC - Gujarat - Vitthalapur","Pasona India private Limited","Ahmedabad","Canteen- transpiration- HR Administration- Contract Labour Management...","2018-03-21",1.0,5.0,300000.0,350000.0
"Acon / Con / AM - Organisation Design ( HR )","Acon / Con / AM - Organisation Design ( HR )","Pylon Management Consulting Pvt Ltd","Gurgaon","HR Analytics- Organizational Development- Organisation Design- organisation...","2018-03-21",3.0,6.0,700000.0,1200000.0
"Final Drive for Walk-in for HR Executive - Treeline Chennai","Final Drive for Walk-in for HR Executive - Treeline Chennai","Treeline Business Solutions Pvt Ltd","Chennai(Teynampet)","HR- Exit Formalities- Employee Engagement- LWF- Payroll Processing- Leave...","2018-03-21",1.0,4.0,200000.0,250000.0
"HR Staffing Specialist","HR Staffing Specialist","HEADHUNTERS HR PVT. LTD.","Mumbai- Mumbai Suburbs","hr- human resource- hr consultant- hr executive- recruiter...","2018-03-20",0.0,5.0,100000.0,350000.0
"Immediate Hiring for HR Recruiter - Madurai","Immediate Hiring for HR Recruiter - Madurai","PeopleStrong HR Services Pvt. Ltd.","Chennai- Madurai","non it recruitment- interviewing- non it recruiter- screening- hiring...","2018-03-20",2.0,3.0,250000.0,375000.0
"Immediate Hiring for HR Recruiter - Ahmedabad(preferred Male)","Immediate Hiring for HR Recruiter - Ahmedabad(preferred Male)","PeopleStrong HR Services Pvt. Ltd.","Gurgaon","non it recruitment- interviewing- non it recruiter- screening- hiring...","2018-03-20",2.0,3.0,250000.0,375000.0
"Urgent Hiring for HR Recruiter - Mumbai","Urgent Hiring for HR Recruiter - Mumbai","PeopleStrong HR Services Pvt. Ltd.","Mumbai","non it recruitment- bulk hiring- screening- sourcing- interviewing...","2018-03-20",1.0,4.0,200000.0,300000.0
"Opportunity for HR Executive- Recruitment/employee Realtions for Fresh","Opportunity for HR Executive- Recruitment/employee Realtions for Fresh","Manning Consultant","Jaipur","Recruitment- HR- hr executive- Mba Hr Fresher- Hr Mba- hr executive fresher...","2018-03-21",0.0,5.0,250000.0,300000.0
"Opening for HR Recruiter/it Recruiter/talent Acquisition for Bangalore","Opening for HR Recruiter/it Recruiter/talent Acquisition for Bangalore","Job World India Pvt Ltd Limited","Bengaluru","IT Recruitment- Permanent Staffing- Talent Acquisition- HR- Interviewing...","2018-03-21",0.0,1.0,0.0,0.0
"HR Recruiter","HR Recruiter","Local Fox","Bengaluru","Recruitment- HR- Sourcing- IT Recruitment- Non IT Recruitment...","2018-03-21",0.0,2.0,50000.0,250000.0
"Hiring for HR Recruiter HR Executive (vikaspuri)","Hiring for HR Recruiter HR Executive (vikaspuri)","Expert Staffing Solutions","Delhi(Vikas Puri)","recruitment- mba hr- hr executive- mba fresher- bulk hiring- consultant...","2018-03-21",0.0,2.0,70000.0,225000.0
"HR Recruiter for Consultancy","HR Recruiter for Consultancy","MARS Placements Services","Delhi","HR Recruiter- recruitment- human resource- Manpower- Placement services- ...","2018-03-21",0.0,1.0,0.0,0.0
"Recruitment Officer @ HR Consultancy Kolkata","Recruitment Officer @ HR Consultancy Kolkata","SSI Management Consultants","Kolkata","recruitment- hr- english- recruiter- fresher- talent acquisition- sourcing-...","2018-03-21",0.0,1.0,90000.0,150000.0
"HR - Intern","HR - Intern","Tata AIA Life Insurance Company Ltd.","Pune","Orientation- HR- Recruitment- Human Resource Management- Mba Fresher...","2018-03-22",0.0,0.0,0.0,0.0
"Assistant Manager HR/ Recruitment Manager/ Freshers / Experienced","Assistant Manager HR/ Recruitment Manager/ Freshers / Experienced","S consultancy and Marketing Services","Chennai","HR Recruiter- recruitment executive- hiring executive...","2018-03-21",1.0,5.0,150000.0,400000.0
"Hiring Sr. Executive - Human Resource For Patna","Hiring Sr. Executive - Human Resource For Patna","Jubilant Foodworks Limited","Patna","bulk hiring- employee engagement- HRBP- Talent Acquisition...","2018-03-20",4.0,6.0,0.0,0.0
"Urgent Requirement - HR Recruiter / Sr. Recruiter - Consultancy","Urgent Requirement - HR Recruiter / Sr. Recruiter - Consultancy","Talent Switcher","Delhi(Delhi University)- Delhi NCR","recruitment- recruitment executive- hiring executive- hiring assistant...","2018-03-21",1.0,6.0,90000.0,300000.0
"Opportunity for Dynamic HR Professionals","Opportunity for Dynamic HR Professionals","SKP Business Consulting LLP","Pune(Baner Pashan Link Road)","HR Manual- Employee Engagement- Employee Grievances- Induction- Training...","2018-03-21",1.0,3.0,200000.0,300000.0
"Contractual Job for SAP HR Functional Consultant-pune(viman Nagar)","Contractual Job for SAP HR Functional Consultant-pune(viman Nagar)","Talent  Corner HR Services Pvt Ltd","Pune","SAP HR- SAP HCM Functional Consultant- contract basis- contractual job...","2018-03-21",7.0,12.0,600000.0,1400000.0
"Data Analyst HR | Shahi Exports | Bangalore","Data Analyst HR | Shahi Exports | Bangalore","Shahi Exports Pvt Ltd.","Bengaluru(Bellandur)","hr- data analysis- HRIS Analyst- Data Analytics- MIS Preparation","2018-03-21",1.0,5.0,0.0,0.0
"HR Executive - Automobilebangalore","HR Executive - Automobilebangalore","Xpertz HR and Management Solutions","Bengaluru","HR- MHRM- Mba","2018-03-21",3.0,4.0,300000.0,400000.0
"HR Executive | HR Manager| HR Generalist| Payroll| Compliance","HR Executive | HR Manager| HR Generalist| Payroll| Compliance","Grabit HR","Delhi NCR- Delhi- Gurgaon- Faridabad- Rohtak- Sonepat","HR Generalist Activities- Bonus- Gratuity- Payroll- General Administration-...","2018-03-21",0.0,3.0,200000.0,450000.0
"HR Executive | HR Manager| HR Generalist (bposales CCE Preff.)","HR Executive | HR Manager| HR Generalist (bposales CCE Preff.)","Grabit HR","Delhi NCR- Delhi- Greater Noida- Noida- Meerut- Ghaziabad","hr generalist activities- bpo sales- training- human resource management...","2018-03-21",0.0,3.0,225000.0,450000.0
"Urgent Opening for HR Executive | HR Freshers / Any Graduate /MNC","Urgent Opening for HR Executive | HR Freshers / Any Graduate /MNC","ASA HR Management","Delhi- Faridabad- Ghaziabad- Greater Noida- Gurgaon- Noida","Hr Mba- Employee Grievances- Payroll Processing- General Administration...","2018-03-21",0.0,3.0,175000.0,400000.0
"HR Business Partner with MNC","HR Business Partner with MNC","PES HR Services a div of AMAL INFOSYSTEMS Pvt Ltd","Hyderabad","hr business partner- hrbp- hrbp analyst- hr business partner analyst...","2018-03-21",2.0,6.0,0.0,0.0
"Admin & HR Executive / Front Office (female Only) Japanese MNC Gurgaon","Admin & HR Executive / Front Office (female Only) Japanese MNC Gurgaon","Coaction HR Consultant.","Delhi NCR- Gurgaon","admin executive- administration- front office- front office executive...","2018-03-21",1.0,2.0,200000.0,250000.0
"HR Support Executive - Day Shift","HR Support Executive - Day Shift","Nest Global Consulting Services","Hyderabad","Hiring- HR- Voice Process- HR executive- hr support executive","2018-03-22",2.0,6.0,150000.0,300000.0
"Manager / Senior Manager - Human Resources","Manager / Senior Manager - Human Resources","Securitas India","Gurgaon","recruitment- sourcing profiles- talent acquisition- interviewing...","2018-03-20",6.0,10.0,0.0,0.0
"Urgent Opening for Sr. Hr-executive- Logistics Co- Bhiwandi Mumbai","Urgent Opening for Sr. Hr-executive- Logistics Co- Bhiwandi Mumbai","Ecom Express Private Limited","Mumbai- Mumbai Suburbs- Navi Mumbai- Thane","recruitment- hr policies- talent acquisition- bulk hiring...","2018-03-20",3.0,8.0,150000.0,375000.0
"Opening for HR Executive with Myecoenergy Pvt Ltd","Opening for HR Executive with Myecoenergy Pvt Ltd","My Own Eco Energy Pvt. Ltd.","Indore- Lucknow- Bhubaneshwar- Jaipur","Recruitment- Talent Acquisition- HRIS- Joining Formalities...","2018-03-20",2.0,5.0,0.0,0.0
"HR Business Partner- FMCG Co- Patna(only Male).sales Hiring exp must","HR Business Partner- FMCG Co- Patna(only Male).sales Hiring exp must","Varun Beverages Limited","Patna","talent acquisition- exit interviews- exit management- sales recruitment...","2018-03-20",5.0,10.0,0.0,0.0
"HR Generalist","HR Generalist","GVK Emergency Management And Research Institute","Ahmedabad","Payroll- Salary- Attendance- HR Generalist- Statutory Compliance- Ahmedabad...","2018-03-20",2.0,7.0,200000.0,300000.0
"HR Executive @ Intellecta Consultants for Leadership Hiring - Malad","HR Executive @ Intellecta Consultants for Leadership Hiring - Malad","Intellecta Consultants","Mumbai- Mumbai Suburbs","recruitment- sourcing profiles- talent acquisition- hiring- finance hiring-...","2018-03-22",0.0,5.0,150000.0,250000.0
"Site HR/ Admin Executive","Site HR/ Admin Executive","Shreeji Infraspace Pvt. Ltd","Rewa","hr executive- hr & administration executive- hr- admin executive...","2018-03-21",1.0,6.0,100000.0,250000.0
"Senior Officer HR","Senior Officer HR","Eros Infrastructures Pvt. Ltd.","Nagpur","HR- Contract Labour- IR- industrial relation- labour laws...","2018-03-21",7.0,12.0,175000.0,325000.0
"HR Manager","HR Manager","HUBERT ENVIRO CARE SYSTEMS (P) LTD","Chennai","Attendance- Statutory Audit- Auditing- Human Resource Management- HR","2018-03-21",3.0,5.0,350000.0,400000.0
"HR Executive","HR Executive","VOV International","Mumbai","HR- Training- Performance Appraisal- Onboarding- Payroll- Advanced Excel","2018-03-21",1.0,2.0,175000.0,250000.0
"Urgent Opening for Regional HR - Bangalore","Urgent Opening for Regional HR - Bangalore","HDB Financial Services Limited","Bengaluru","Regional HR Executive- Bulk Hiring- mass hiring- Sales Hiring- Banking","2018-03-21",3.0,8.0,300000.0,500000.0
"Walk in for Assistant Manager Operations & HR Executive for BPO","Walk in for Assistant Manager Operations & HR Executive for BPO","CARETEL INFOTECH LIMITED","Chennai(Anna Industrial Estate)","Human Resource Management- HR- Call Center- BPO- Calling...","2018-03-21",1.0,4.0,50000.0,300000.0
"Dgm/agm/gm -ir/hr (nagpur)","Dgm/agm/gm -ir/hr (nagpur)","Shree Rajasthan Syntex Limited","Nagpur","HR- GM- DGM- Agm- Union Negotiations- IR- Labor Management","2018-03-21",15.0,25.0,0.0,0.0
"Urgent Walk-in - Regional HR - Mumbai","Urgent Walk-in - Regional HR - Mumbai","HDB Financial Services Limited","Mumbai","Regional HR- Bulk Hiring- mass hiring- Sales Hiring- Banking","2018-03-21",3.0,8.0,0.0,0.0
"HR Manager - Kandivali","HR Manager - Kandivali","Ravi Group","Mumbai","HR- Hiring- Human Resource Management- HR Manager- human resource manager","2018-03-21",4.0,6.0,500000.0,700000.0
"Plant HR Manager","Plant HR Manager","TOLIA INDUSTRIES","Thane","HR- Employee Relations- Policies- Human Resource Management","2018-03-21",3.0,6.0,0.0,0.0
"Urgent Opening for HR Manager - Nashik Location","Urgent Opening for HR Manager - Nashik Location","Shweta Infrastructure  Housing (I) Pvt Ltd","Nasik","HR Operations- HR Functions- Human Resource Management...","2018-03-21",6.0,8.0,0.0,0.0
"Human Resources - Internal Auditor","Human Resources - Internal Auditor","UBS Business Solutions (India) Pvt. Ltd.","Mumbai","auditing- internal audit- compliance- risk assessment- report preparation...","2018-03-21",4.0,6.0,0.0,0.0
"Male HR Manager - Manufacturers Of  Sports Apparels - Kanpur","Male HR Manager - Manufacturers Of  Sports Apparels - Kanpur","Kickstart Placements","Kanpur","hr- manpower planning- human resource management- recruitments...","2018-03-21",7.0,12.0,800000.0,1400000.0
"HR Executive","HR Executive","Bright Future Consultancy","Manesar","HR- Recruitment- Employee Engagement- Attendance- Salary","2018-03-21",3.0,5.0,0.0,0.0
